"index","relation-type","term1","b1","e1","term2","b2","e2","sentence","job"
"1643","TWrex-symptom","[ACTIVITY]","280","288","[CARCINOMA]","354","363","Microscopically, the pleural neoplasm was composed of three different components: 40% of the tumor showed the classic histology of a malignant epithelial mesothelioma, 40% was composed of small- to medium-sized cells with open nuclear chromatin, evident nucleoli and high mitotic [ACTIVITY], and 20% of the neoplasm was indistinguishable from a small cell [CARCINOMA].","0"
"1644","TWrex-symptom","[RESTRICTION]","149","160","[PSEUDOTHALIDOMIDE SYNDROME]","0","26","[PSEUDOTHALIDOMIDE SYNDROME] is a rare autosomal recessive condition characterized by tetraphocomelia, craniofacial abnormalities and postnatal growth [RESTRICTION].","0"
"1645","TWrex-symptom","[REGURGITATION]","185","198","[SYNDROME]","133","141","A successful case of simultaneous modified Bentall' procedure, MVR and sternoplasty was presented for a 42 years old man of Marfan's [SYNDROME] who had funnel chest, combined with mitral [REGURGITATION], aortic regurgitation and annuloaortic ectasia.","0"
"1646","TWrex-symptom","[REGURGITATION]","207","220","[SYNDROME]","133","141","A successful case of simultaneous modified Bentall' procedure, MVR and sternoplasty was presented for a 42 years old man of Marfan's [SYNDROME] who had funnel chest, combined with mitral regurgitation, aortic [REGURGITATION] and annuloaortic ectasia.","0"
"1647","TWrex-symptom","[HYPOTHERMIA]","157","168","[MENKES DISEASE]","0","14","[MENKES DISEASE] is a rare, sex-linked recessive disorder characterized by kinky hair, convulsion, mental retardation, bone and connective tissue lesions, and [HYPOTHERMIA].","0"
"1649","TWrex-symptom","[OCCIPITAL ENCEPHALOCELE]","178","201","[KNOBLOCH SYNDROME]","0","17","[KNOBLOCH SYNDROME] (KS) is an autosomal recessive disorder defined by the occurrence of high myopia, vitreoretinal degeneration with retinal detachment, macular abnormalities and [OCCIPITAL ENCEPHALOCELE].","0"
"1650","TWrex-symptom","[HYPERTRICHOSIS]","47","61","[SYNDROME]","21","29","In addition to Leigh [SYNDROME] all patients had [HYPERTRICHOSIS], a clinical sign that is not usually associated with Leigh syndrome.","0"
"1651","TWrex-symptom","[HYPERTRICHOSIS]","47","61","[SYNDROME]","121","129","In addition to Leigh syndrome all patients had [HYPERTRICHOSIS], a clinical sign that is not usually associated with Leigh [SYNDROME].","0"
"1652","TWrex-symptom","[DIARRHEA]","43","51","[CROHN DISEASE]","399","412","The combination of chronic abdominal pain, [DIARRHEA], and heme-positive stools associated with inflammatory changes in biopsy specimens obtained from the proximal colon, but normal findings on radiologic, colonoscopic, and rectal biopsy examinations, may represent an early stage in the evolution of chronic nonspecific inflammatory bowel disease, including ulcerative colitis or regional enteritis ([CROHN DISEASE].","0"
"1653","TWrex-symptom","[INFECTION]","33","42","[TUBERCULOSIS]","20","32","The finding that M. [TUBERCULOSIS] [INFECTION] activate JAK2/STAT1-alpha pathway suggests that M. tuberculosis might mimic macrophage-activating stimuli.","0"
"1654","TWrex-symptom","[INFECTION]","33","42","[TUBERCULOSIS]","94","106","The finding that M. tuberculosis [INFECTION] activate JAK2/STAT1-alpha pathway suggests that M. [TUBERCULOSIS] might mimic macrophage-activating stimuli.","0"
"1655","TWrex-symptom","[STRIDOR]","10","17","[PMD]","66","69","Transient [STRIDOR] and nystagmus were early signs in both types of [PMD].","0"
"1656","TWrex-symptom","[INEFFECTIVE HEMATOPOIESIS]","70","95","[MYELODYSPLASTIC SYNDROME]","0","24","[MYELODYSPLASTIC SYNDROME]s (MDS) are clonal disorders characterized by [INEFFECTIVE HEMATOPOIESIS] with rare occurrence in childhood.","0"
"1657","TWrex-symptom","[CARCINOMA]","58","67","[HEPATOCELLULAR CARCINOMA]","238","262","Several aspects are revised on the subject hepatocellular [CARCINOMA] related to its incidence/prevalence, risk and prognostic factors, cellular proliferation, pathological aspects, progression of chronic hepatitis B and C to cirrhosis and [HEPATOCELLULAR CARCINOMA], natural course of hepatocellular carcinoma, some clinical data, morphological diagnosis with special emphasis on radiological findings as ultrasound, dynamic computed tomography and magnetic resonance imaging, color-power Doppler, tissue and contrast harmonic.","0"
"1658","TWrex-symptom","[CARCINOMA]","58","67","[HEPATOCELLULAR CARCINOMA]","282","306","Several aspects are revised on the subject hepatocellular [CARCINOMA] related to its incidence/prevalence, risk and prognostic factors, cellular proliferation, pathological aspects, progression of chronic hepatitis B and C to cirrhosis and hepatocellular carcinoma, natural course of [HEPATOCELLULAR CARCINOMA], some clinical data, morphological diagnosis with special emphasis on radiological findings as ultrasound, dynamic computed tomography and magnetic resonance imaging, color-power Doppler, tissue and contrast harmonic.","0"
"1659","TWrex-symptom","[CARCINOMA]","253","262","[HEPATOCELLULAR CARCINOMA]","43","67","Several aspects are revised on the subject [HEPATOCELLULAR CARCINOMA] related to its incidence/prevalence, risk and prognostic factors, cellular proliferation, pathological aspects, progression of chronic hepatitis B and C to cirrhosis and hepatocellular [CARCINOMA], natural course of hepatocellular carcinoma, some clinical data, morphological diagnosis with special emphasis on radiological findings as ultrasound, dynamic computed tomography and magnetic resonance imaging, color-power Doppler, tissue and contrast harmonic.","0"
"1660","TWrex-symptom","[CARCINOMA]","253","262","[HEPATOCELLULAR CARCINOMA]","282","306","Several aspects are revised on the subject hepatocellular carcinoma related to its incidence/prevalence, risk and prognostic factors, cellular proliferation, pathological aspects, progression of chronic hepatitis B and C to cirrhosis and hepatocellular [CARCINOMA], natural course of [HEPATOCELLULAR CARCINOMA], some clinical data, morphological diagnosis with special emphasis on radiological findings as ultrasound, dynamic computed tomography and magnetic resonance imaging, color-power Doppler, tissue and contrast harmonic.","0"
"1661","TWrex-symptom","[CARCINOMA]","297","306","[HEPATOCELLULAR CARCINOMA]","43","67","Several aspects are revised on the subject [HEPATOCELLULAR CARCINOMA] related to its incidence/prevalence, risk and prognostic factors, cellular proliferation, pathological aspects, progression of chronic hepatitis B and C to cirrhosis and hepatocellular carcinoma, natural course of hepatocellular [CARCINOMA], some clinical data, morphological diagnosis with special emphasis on radiological findings as ultrasound, dynamic computed tomography and magnetic resonance imaging, color-power Doppler, tissue and contrast harmonic.","0"
"1662","TWrex-symptom","[CARCINOMA]","297","306","[HEPATOCELLULAR CARCINOMA]","238","262","Several aspects are revised on the subject hepatocellular carcinoma related to its incidence/prevalence, risk and prognostic factors, cellular proliferation, pathological aspects, progression of chronic hepatitis B and C to cirrhosis and [HEPATOCELLULAR CARCINOMA], natural course of hepatocellular [CARCINOMA], some clinical data, morphological diagnosis with special emphasis on radiological findings as ultrasound, dynamic computed tomography and magnetic resonance imaging, color-power Doppler, tissue and contrast harmonic.","0"
"1663","TWrex-symptom","[RETARDATION]","166","177","[SYNDROME]","18","26","Smith-Lemli-Opitz [SYNDROME] (SLOS) is an autosomal recessive syndrome, characterized by severe growth failure and congenital anomalies (for example dysgenesis, mental [RETARDATION], renal and cardiac defects, and various malformation.","0"
"1664","TWrex-symptom","[RETARDATION]","166","177","[SYNDROME]","60","68","Smith-Lemli-Opitz syndrome (SLOS) is an autosomal recessive [SYNDROME], characterized by severe growth failure and congenital anomalies (for example dysgenesis, mental [RETARDATION], renal and cardiac defects, and various malformation.","0"
"1666","TWrex-symptom","[DEPRESSION]","42","52","[HD]","20","22","Fifty patients with [HD] completed the Beck [DEPRESSION] Inventory-II (BDI-II), the Hospital Anxiety and Depression Scale (HADS), and the Depression Intensity Scale Circles (DISCs.","0"
"1667","TWrex-symptom","[DEPRESSION]","101","111","[HD]","20","22","Fifty patients with [HD] completed the Beck Depression Inventory-II (BDI-II), the Hospital Anxiety and [DEPRESSION] Scale (HADS), and the Depression Intensity Scale Circles (DISCs.","0"
"1668","TWrex-symptom","[DEPRESSION]","134","144","[HD]","20","22","Fifty patients with [HD] completed the Beck Depression Inventory-II (BDI-II), the Hospital Anxiety and Depression Scale (HADS), and the [DEPRESSION] Intensity Scale Circles (DISCs.","0"
"1670","TWrex-symptom","[HYPEREXTENSIBLE SKIN]","130","150","[SYNDROME]","225","233","Individuals bearing the mutation, whether they had experienced an episode of cortical hyperostosis or not, had joint hyperlaxity, [HYPEREXTENSIBLE SKIN], and inguinal hernias resembling symptoms of a mild form of Ehlers-Danlos [SYNDROME] type III.","0"
"1671","TWrex-symptom","[OBESITY]","155","162","[SYNDROME]","13","21","Bardet-Biedl [SYNDROME] (BBS) is a clinically and genetically heterogeneous autosomal recessive disorder characterized by retinitis pigmentosa, polydactyly, [OBESITY], hypogenitalism, mental retardation, and renal anomalies.","0"
"1672","TWrex-symptom","[PROGNATHIA]","124","134","[ANGELMAN SYNDROME]","25","42","The clinical features of [ANGELMAN SYNDROME] (AS) comprise severe mental retardation, postnatal microcephaly, macrostomia and [PROGNATHIA], absence of speech, ataxia, and a happy disposition.","0"
"1673","TWrex-symptom","[RETARDATION]","101","112","[SYNDROME]","6","14","Barth [SYNDROME] is an inherited disorder characterized by dilated cardiomyopathy, neutropenia, growth [RETARDATION], and skeletal myopathy.","0"
"1674","TWrex-symptom","[MUSCLE RIGIDITY]","25","40","[HYPERTHERMIA]","148","160","He developed high fever, [MUSCLE RIGIDITY], tachycardia, arrhythmias, hypotension and mottled cyanosis, symptoms well-known in persons with malignant [HYPERTHERMIA], an autosomally inherited disease of skeletal muscle.","0"
"1675","TWrex-symptom","[AGENESIS OF THE CORPUS CALLOSUM]","0","31","[SYNDROME]","108","116","[AGENESIS OF THE CORPUS CALLOSUM] and malformation of limbic structures are described in a patient with Apert [SYNDROME], a disorder characterized by acrocephaly, severe syndactyly, and often, mental retardation.","0"
"1676","TWrex-symptom","[PAIN]","206","210","[TRIGEMINAL NEURALGIA]","93","113","We think that microvascular decompression (MVD) should be the first operation considered for [TRIGEMINAL NEURALGIA], but we BCR as the procedure of choice in the aged and medically infirm, especially when V1 [PAIN] is present, in patients with multiple sclerosis, for recurrences after other procedures, and in virtually any situation in which MVD is, for some reason, not feasible.","0"
"1679","TWrex-symptom","[INFECTION]","123","132","[HIV]","32","35","By December 1986, 82 (45%) were [HIV] seropositive, and of these, ten (12%) had developed AIDS, 28 (34%) had symptomatic hiv [INFECTION] (CDC class III, IV), of whom 14 (17%) had AIDS-related complex (ARC), and 44 (54%) had asymptomatic hiv infection (CDC class II.","0"
"1680","TWrex-symptom","[INFECTION]","123","132","[HIV]","119","122","By December 1986, 82 (45%) were hiv seropositive, and of these, ten (12%) had developed AIDS, 28 (34%) had symptomatic [HIV] [INFECTION] (CDC class III, IV), of whom 14 (17%) had AIDS-related complex (ARC), and 44 (54%) had asymptomatic hiv infection (CDC class II.","0"
"1681","TWrex-symptom","[INFECTION]","123","132","[HIV]","233","236","By December 1986, 82 (45%) were hiv seropositive, and of these, ten (12%) had developed AIDS, 28 (34%) had symptomatic hiv [INFECTION] (CDC class III, IV), of whom 14 (17%) had AIDS-related complex (ARC), and 44 (54%) had asymptomatic [HIV] infection (CDC class II.","0"
"1682","TWrex-symptom","[INFECTION]","237","246","[HIV]","32","35","By December 1986, 82 (45%) were [HIV] seropositive, and of these, ten (12%) had developed AIDS, 28 (34%) had symptomatic hiv infection (CDC class III, IV), of whom 14 (17%) had AIDS-related complex (ARC), and 44 (54%) had asymptomatic hiv [INFECTION] (CDC class II.","0"
"1683","TWrex-symptom","[INFECTION]","237","246","[HIV]","119","122","By December 1986, 82 (45%) were hiv seropositive, and of these, ten (12%) had developed AIDS, 28 (34%) had symptomatic [HIV] infection (CDC class III, IV), of whom 14 (17%) had AIDS-related complex (ARC), and 44 (54%) had asymptomatic hiv [INFECTION] (CDC class II.","0"
"1684","TWrex-symptom","[INFECTION]","237","246","[HIV]","233","236","By December 1986, 82 (45%) were hiv seropositive, and of these, ten (12%) had developed AIDS, 28 (34%) had symptomatic hiv infection (CDC class III, IV), of whom 14 (17%) had AIDS-related complex (ARC), and 44 (54%) had asymptomatic [HIV] [INFECTION] (CDC class II.","0"
"1685","TWrex-symptom","[SEIZURE]","62","69","[EPILEPSY]","138","146","As a benchmark we used the discriminative power to detect the [SEIZURE]-generating hemisphere in medically intractable mesial temporal lobe [EPILEPSY].","0"
"1686","TWrex-symptom","[PARKINSONISM]","182","194","[DLB]","0","3","[DLB] is the second most common neurodegenerative dementia after Alzheimer's disease, which is characterized clinically by fluctuating cognitive impairments, visual hallucinations and [PARKINSONISM], and pathologically by the appearance of cortical LBs. To characterize the components of LBs, we have developed a purification procedure for LBs from cortices of patients with dlb using sucrose density separation followed by fluorescence-activated particle sorting.","0"
"1687","TWrex-symptom","[PARKINSONISM]","182","194","[DLB]","371","374","dlb is the second most common neurodegenerative dementia after Alzheimer's disease, which is characterized clinically by fluctuating cognitive impairments, visual hallucinations and [PARKINSONISM], and pathologically by the appearance of cortical LBs. To characterize the components of LBs, we have developed a purification procedure for LBs from cortices of patients with [DLB] using sucrose density separation followed by fluorescence-activated particle sorting.","0"
"1688","TWrex-symptom","[TUBULAR PATTERN]","21","36","[ACC]","0","3","[ACC] with predominant [TUBULAR PATTERN] presented a significantly lower mean index of MT immunopositivity than did solid or cribriform subtypes, while these two latter groups did not differ in terms of MT expression.","0"
"1689","TWrex-symptom","[TREMOR]","33","39","[WILSON'S DISEASE]","93","109","A pediatric case presenting with [TREMOR] of the tongue and dysarthria as the only findings of [WILSON'S DISEASE] is reported.","0"
"1690","TWrex-symptom","[EXOCRINE PANCREATIC INSUFFICIENCY]","81","114","[SYNDROME]","18","26","Shwachman-Diamond [SYNDROME] (SDS) is a rare multisystem disorder characterized by [EXOCRINE PANCREATIC INSUFFICIENCY], bone marrow dysfunction, and metaphyseal chondrodysplasia.","0"
"1691","TWrex-symptom","[HEADACHE]","0","8","[MIGRAINE]","14","22","[HEADACHE]-free [MIGRAINE] sufferers had increased numbers of dense bodies, decreased dense body secretion, a defective link between cytosolic ionized calcium and platelet activation, an abnormal sensitivity to activation by platelet-activating factor and decreased serotonin metabolism in the presence of an unactivated platelet.","0"
"1692","TWrex-symptom","[PAIN]","41","45","[FIBROMYALGIA]","0","12","[FIBROMYALGIA] is a common musculoskeletal [PAIN] condition associated with chronic widespread pain, tenderness at various points on the body, fatigue, and sleep abnormalities.","0"
"1693","TWrex-symptom","[PAIN]","91","95","[FIBROMYALGIA]","0","12","[FIBROMYALGIA] is a common musculoskeletal pain condition associated with chronic widespread [PAIN], tenderness at various points on the body, fatigue, and sleep abnormalities.","0"
"1694","TWrex-symptom","[HYPOPLASIA]","117","127","[SYNDROME]","8","16","Apert's [SYNDROME] is a developmental malformation characterized by craniosynostosis, a cone shaped calvarium, midface [HYPOPLASIA], pharyngeal attenuation, ocular manifestations and syndactyly of the hands and feet.","0"
"1695","TWrex-symptom","[HEADACHE]","9","17","[MIGRAINE]","0","8","[MIGRAINE] [HEADACHE]s affect 12% of the adult population in the United States and cause a significant economic loss due to decreased workplace productivity Although interactions between pharmacists and individuals with headache are common, few pharmacists receive adequate training regarding migraine therapy.","0"
"1696","TWrex-symptom","[HEADACHE]","9","17","[MIGRAINE]","289","297","Migraine [HEADACHE]s affect 12% of the adult population in the United States and cause a significant economic loss due to decreased workplace productivity Although interactions between pharmacists and individuals with headache are common, few pharmacists receive adequate training regarding [MIGRAINE] therapy.","0"
"1697","TWrex-symptom","[HEADACHE]","216","224","[MIGRAINE]","0","8","[MIGRAINE] headaches affect 12% of the adult population in the United States and cause a significant economic loss due to decreased workplace productivity Although interactions between pharmacists and individuals with [HEADACHE] are common, few pharmacists receive adequate training regarding migraine therapy.","0"
"1698","TWrex-symptom","[HEADACHE]","216","224","[MIGRAINE]","289","297","Migraine headaches affect 12% of the adult population in the United States and cause a significant economic loss due to decreased workplace productivity Although interactions between pharmacists and individuals with [HEADACHE] are common, few pharmacists receive adequate training regarding [MIGRAINE] therapy.","0"
"1699","TWrex-symptom","[PAIN]","8","12","[COMPLEX REGIONAL PAIN SYNDROME TYPE I]","28","65","Chronic [PAIN] resulting from [COMPLEX REGIONAL PAIN SYNDROME TYPE I] (CRPS I), formerly referred to as the reflex sympathetic dystrophy syndrome (RSDS), is a diagnostic challenge to the clinician.","0"
"1701","TWrex-symptom","[MENTAL RETARDATION]","115","133","[CORNELIA DE LANGE SYNDROME]","0","26","[CORNELIA DE LANGE SYNDROME] (CdLS) is a multiple malformation disorder characterized by dysmorphic facial features, [MENTAL RETARDATION], growth delay and limb reduction defects.","0"
"1703","TWrex-symptom","[DIARRHEA]","152","160","[TRAVELLER'S DIARRHEA]","168","188","Four cases chosen from the outpatient department of a Swiss medical polyclinic are presented and serve as a basis for discussing persistent and chronic [DIARRHEA], acute [TRAVELLER'S DIARRHEA], and hypereosinophilia.","0"
"1704","TWrex-symptom","[SEIZURE]","76","83","[DRAVET SYNDROME]","0","15","[DRAVET SYNDROME] is a severe infantile onset epilepsy syndrome with multiple [SEIZURE] types, developmental slowing and poor outcome.","0"
"1705","TWrex-symptom","[ENAMEL HYPOPLASIA]","158","175","[SLS]","44","47","Compared with fully healthy individuals the [SLS]-patients had higher caries indices, a higher frequency of gingivitis and periodontitis, a higher frequency of [ENAMEL HYPOPLASIA]s, but a similar prevalence of malocclusions.","0"
"1706","TWrex-symptom","[HYPERTELORISM]","105","118","[SYNDROME]","2","10","G [SYNDROME] is a familial constellation of congenital anomalies that include a distinctive facies, ocular [HYPERTELORISM], prominent occiput and forehead, short lingual frenulum, stridor, hoarse cry, and laryngotracheoesophageal (LTE) clefts, as well as hypospadias and cryptorchidism.","0"
"1707","TWrex-symptom","[KERATOCYST]","0","10","[NEVOID BASAL CELL CARCINOMA SYNDROME]","113","149","[KERATOCYST]s of the solitary type were histologically and histometrically compared with those associated with the [NEVOID BASAL CELL CARCINOMA SYNDROME] (NBS.","0"
"1708","TWrex-symptom","[HYDROCEPHALUS]","68","81","[WWS]","237","240","We report the case of an infant with facial dysmorphism, congenital [HYDROCEPHALUS], severe hypotonia and absence of psychomotor development, with ocular and cerebral malformations consistent with the diagnosis of Walker-Warburg syndrome ([WWS].","0"
"1709","TWrex-symptom","[PAIN]","84","88","[POSTHERPETIC NEURALGIA]","120","142","Today's systemic antiviral drugs can reduce the severity of the eruption, limit the [PAIN], and diminish the incidence of [POSTHERPETIC NEURALGIA].","0"
"1710","TWrex-symptom","[BLACK LIVER]","75","86","[DJS]","46","49","This case illustrates for the first time that [DJS] is not the only cause of [BLACK LIVER].","0"
"1711","TWrex-symptom","[SEIZURE]","117","124","[ABSENCE STATUS]","176","190","In a group of 185 children treated with cyclosporine after bone marrow transplantation, 15 (8%) presented with acute [SEIZURE]s that were generalized in 7 and focal in 7 and had [ABSENCE STATUS] in 1.","0"
"1712","TWrex-symptom","[PAIN]","228","232","[CARCINOMA]","46","55","We describe a case of metastatic ameloblastic [CARCINOMA] in both kidneys of a 38-year-old Japanese man, who had a history of malignant ameloblastoma and was referred to us for evaluation because of gross hematuria and left flank [PAIN].","0"
"1713","TWrex-symptom","[PAIN]","42","46","[PHN]","205","208","PERSPECTIVE: Comprehensive assessments of [PAIN] are necessary for clinical research on the epidemiology, natural history, pathophysiologic mechanisms, treatment, and prevention of pain in herpes zoster and [PHN].","0"
"1714","TWrex-symptom","[PAIN]","179","183","[PHN]","205","208","PERSPECTIVE: Comprehensive assessments of pain are necessary for clinical research on the epidemiology, natural history, pathophysiologic mechanisms, treatment, and prevention of [PAIN] in herpes zoster and [PHN].","0"
"1715","TWrex-symptom","[SCOLIOSIS]","68","77","[RETT SYNDROME]","81","94","Surgery in a specialized unit is satisfactory management for severe [SCOLIOSIS] in [RETT SYNDROME].","0"
"1716","TWrex-symptom","[DIABETES]","151","159","[WOLFRAM SYNDROME]","0","16","[WOLFRAM SYNDROME] (WFS1, OMIM 222300) is a rare genetic disorder associated with multiple organ abnormalities, most prominently optic nerve atrophy and [DIABETES].","0"
"1717","TWrex-symptom","[ACANTHOSIS]","379","389","[DISEASE]","323","330","Skin changes associated with internal malignancies can be classified into five groups: 1) cutaneous metastasis from internal malignancies, 2) non-specific reactional skin changes caused by toxic or allergic processes due to these malignancies, including pruritus cutaneous, urticaria and so on, 3) specific skin changes or [DISEASE]s closely related to the malignancies, including [ACANTHOSIS] nigricans, dermatomyositis, Leser- Trélat syndrome, 4) the syndrome caused by simultaneous effects of oncogenesis both on the skin and on the internal organs, including multiple Bowen's disease, and 5) congenital hereditary syndrome.","0"
"1718","TWrex-symptom","[ACANTHOSIS]","379","389","[DISEASE]","577","584","Skin changes associated with internal malignancies can be classified into five groups: 1) cutaneous metastasis from internal malignancies, 2) non-specific reactional skin changes caused by toxic or allergic processes due to these malignancies, including pruritus cutaneous, urticaria and so on, 3) specific skin changes or diseases closely related to the malignancies, including [ACANTHOSIS] nigricans, dermatomyositis, Leser- Trélat syndrome, 4) the syndrome caused by simultaneous effects of oncogenesis both on the skin and on the internal organs, including multiple Bowen's [DISEASE], and 5) congenital hereditary syndrome.","0"
"1719","TWrex-symptom","[ATAXIA]","198","204","[BIOTINIDASE DEFICIENCY]","61","83","Even without typical cutaneous findings or organic aciduria, [BIOTINIDASE DEFICIENCY] should be considered among the differential diagnosis in any child presenting with either episodic or progressive [ATAXIA] or sensorineural deafness as prompt diagnosis and treatment with biotin may induce an excellent recovery.","0"
"1720","TWrex-symptom","[OEDEMA]","37","43","[PRE-ECLAMPSIA]","129","142","High weight gain, fluid retention or [OEDEMA] is associated with a lower incidence of small babies, but with a higher incidence of [PRE-ECLAMPSIA].","0"
"1722","TWrex-symptom","[PROTEINURIA]","184","195","[PRE-ECLAMPSIA]","0","13","[PRE-ECLAMPSIA] was defined as the occurrence, after 20 weeks' gestation, of a diastolic blood pressure greater than 90 mmHg on two or more occasions at least 4 h apart, and concomitant [PROTEINURIA] greater than 0.3 g/l over a 24-h urine collection period.","0"
"1723","TWrex-symptom","[SEIZURE]","165","172","[EPILEPSY]","48","56","A 21-year-old male presented with temporal lobe [EPILEPSY] associated with a venous angioma in the ipsilateral frontal lobe, presenting as intractable complex partial [SEIZURE]s.","0"
"1724","TWrex-symptom","[PURPURA]","288","295","[TTP]","297","300","Congenital or immunomediated deficiencies of the metalloprotease that cleaves physiologically von Willebrand factor (vWF) reduce or abolish the degradation of ultralarge vWF multimers that cause the formation of intravascular platelet thrombi in patients with thrombotic thrombocytopenic [PURPURA] ([TTP].","0"
"1725","TWrex-symptom","[RETINITIS PIGMENTOSA]","49","69","[SYNDROME]","13","21","Bardet Biedl [SYNDROME] (BBS) includes presence of [RETINITIS PIGMENTOSA] (RP) with obesity, mental retardation, polydactyly and renal abnormalities.","0"
"1730","TWrex-symptom","[PAIN]","27","31","[TRIGEMINAL NEURALGIA]","89","109","Several different types of [PAIN] are found in patients with MS, including extremity pain, [TRIGEMINAL NEURALGIA], Lhermitte's sign, painful tonic spasms, back pain, and headache.","0"
