"index","relation-type","term1","b1","e1","term2","b2","e2","sentence","job"
"1731","TWrex-symptom","[PAIN]","83","87","[TRIGEMINAL NEURALGIA]","89","109","Several different types of pain are found in patients with MS, including extremity [PAIN], [TRIGEMINAL NEURALGIA], Lhermitte's sign, painful tonic spasms, back pain, and headache.","0"
"1732","TWrex-symptom","[PAIN]","129","133","[TRIGEMINAL NEURALGIA]","89","109","Several different types of pain are found in patients with MS, including extremity pain, [TRIGEMINAL NEURALGIA], Lhermitte's sign, [PAIN]ful tonic spasms, back pain, and headache.","0"
"1733","TWrex-symptom","[PAIN]","156","160","[TRIGEMINAL NEURALGIA]","89","109","Several different types of pain are found in patients with MS, including extremity pain, [TRIGEMINAL NEURALGIA], Lhermitte's sign, painful tonic spasms, back [PAIN], and headache.","0"
"1734","TWrex-symptom","[SEIZURE]","81","88","[STATUS]","6","12","After [STATUS] epilepticus, their presence predicts the development of spontaneous [SEIZURE]s.","0"
"1735","TWrex-symptom","[RUPTURE]","100","107","[INFECTIOUS MONONUCLEOSIS]","45","69","We report the case of a 36 year old man with [INFECTIOUS MONONUCLEOSIS] who had a spontaneous splenic [RUPTURE] and who was successfully managed by splenectomy.","0"
"1736","TWrex-symptom","[ABDOMINAL PAIN]","147","161","[SYNDROME]","79","87","A 14-year-old girl with the mitochondrial neurogastrointestinal encephalopathy [SYNDROME] had an 8-year history of intestinal pseudoobstruction with [ABDOMINAL PAIN], persistent vomiting, gastric and duodenal dilatation, and duodenal diverticulosis.","0"
"1737","TWrex-symptom","[DEMENTIA]","100","108","[DISEASE]","7","14","Lafora [DISEASE] (LD) is an autosomal recessive inherited form of progressive myoclonic epilepsy with [DEMENTIA] and ataxia, usually presenting in the second decade of life and inexorably progressing until death.","0"
"1738","TWrex-symptom","[MEDULLARY THYROID CARCINOMA]","156","183","[SYNDROME]","54","62","Multiple endocrine neoplasia (MEN) type 2A, or Sipple [SYNDROME], is a rare autosomal dominantly inherited syndrome, which is characterized as combination of [MEDULLARY THYROID CARCINOMA], pheochromocytoma, primary hyperparathyroidism, sometimes with rarer inherited disorders like Hirschsprung disease and cutaneous lichen amyloidosis.","0"
"1739","TWrex-symptom","[MEDULLARY THYROID CARCINOMA]","156","183","[SYNDROME]","105","113","Multiple endocrine neoplasia (MEN) type 2A, or Sipple syndrome, is a rare autosomal dominantly inherited [SYNDROME], which is characterized as combination of [MEDULLARY THYROID CARCINOMA], pheochromocytoma, primary hyperparathyroidism, sometimes with rarer inherited disorders like Hirschsprung disease and cutaneous lichen amyloidosis.","0"
"1740","TWrex-symptom","[HYPOSPADIAS]","104","115","[BBB SYNDROME]","8","20","Opitz G/[BBB SYNDROME] (OS) is a congenital midline malformation syndrome characterized by hypertelorism, [HYPOSPADIAS], cleft lip/palate, laryngotracheoesophageal abnormalities, imperforate anus, developmental delay and cardiac defects.","0"
"1741","TWrex-symptom","[PAIN]","47","51","[CHRONIC PAIN SYNDROME]","4","25","The [CHRONIC PAIN SYNDROME] differs from chronic [PAIN].","0"
"1744","TWrex-symptom","[PAIN]","161","165","[FIBROMYALGIA]","99","111","Plasma and urinary catecholamines were measured in a blinded manner among 30 patients with primary [FIBROMYALGIA] (PF) and 30 healthy controls without significant [PAIN] to determine possible elevations of catecholamines in PF, as well as their correlations with psychological and clinical variables in this syndrome.","0"
"1745","TWrex-symptom","[SHORT STATURE]","126","139","[TRISOMY 21]","20","30","Down syndrome (DS), [TRISOMY 21], is a genetic disorder in which an extra portion of chromosome 21 leads to mental retardation, [SHORT STATURE], and phenotypic abnormalities.","0"
"1747","TWrex-symptom","[HYPERTELORISM]","89","102","[SYNDROME]","12","20","Opitz G/BBB [SYNDROME] (OS) is a congenital midline malformation syndrome characterized by [HYPERTELORISM], hypospadias, cleft lip/palate, laryngotracheoesophageal abnormalities, imperforate anus, developmental delay and cardiac defects.","0"
"1748","TWrex-symptom","[HYPERTELORISM]","89","102","[SYNDROME]","63","71","Opitz G/BBB syndrome (OS) is a congenital midline malformation [SYNDROME] characterized by [HYPERTELORISM], hypospadias, cleft lip/palate, laryngotracheoesophageal abnormalities, imperforate anus, developmental delay and cardiac defects.","0"
"1749","TWrex-symptom","[HEMANGIOMA]","75","85","[SYNDROME]","43","51","Herein, we describe a case of Sturge-Weber [SYNDROME] with diffuse choroidal [HEMANGIOMA] which was successfully treated with low dose lens-sparing external beam radiotherapy.","0"
"1750","TWrex-symptom","[ASTHMA]","238","244","[ATOPIC DERMATITIS]","65","82","Frequently associated with respiratory allergy during adulthood, [ATOPIC DERMATITIS] often represents the first phenotypic appearance of atopy in early childhood when the allergic 'march' starts and progressively moves toward food allergy, [ASTHMA], and rhinitis.","0"
"1751","TWrex-symptom","[HEADACHE]","69","77","[MIGRAINE]","320","328","To see whether vascular reactivity differed among clinically-defined [HEADACHE] categories, amplitude of pulsation of the superficial temporal artery, facial temperature, blood pressure, heart rate and respiration rate were monitored during mental arithmetic and reaction time tests in 30 young women subject to classical [MIGRAINE], common migraine or episodically-recurring tension headaches, and in 10 others who rarely or never had headaches.","0"
"1752","TWrex-symptom","[HEADACHE]","69","77","[MIGRAINE]","337","345","To see whether vascular reactivity differed among clinically-defined [HEADACHE] categories, amplitude of pulsation of the superficial temporal artery, facial temperature, blood pressure, heart rate and respiration rate were monitored during mental arithmetic and reaction time tests in 30 young women subject to classical migraine, common [MIGRAINE] or episodically-recurring tension headaches, and in 10 others who rarely or never had headaches.","0"
"1753","TWrex-symptom","[HEADACHE]","380","388","[MIGRAINE]","320","328","To see whether vascular reactivity differed among clinically-defined headache categories, amplitude of pulsation of the superficial temporal artery, facial temperature, blood pressure, heart rate and respiration rate were monitored during mental arithmetic and reaction time tests in 30 young women subject to classical [MIGRAINE], common migraine or episodically-recurring tension [HEADACHE]s, and in 10 others who rarely or never had headaches.","0"
"1754","TWrex-symptom","[HEADACHE]","380","388","[MIGRAINE]","337","345","To see whether vascular reactivity differed among clinically-defined headache categories, amplitude of pulsation of the superficial temporal artery, facial temperature, blood pressure, heart rate and respiration rate were monitored during mental arithmetic and reaction time tests in 30 young women subject to classical migraine, common [MIGRAINE] or episodically-recurring tension [HEADACHE]s, and in 10 others who rarely or never had headaches.","0"
"1755","TWrex-symptom","[HEADACHE]","432","440","[MIGRAINE]","320","328","To see whether vascular reactivity differed among clinically-defined headache categories, amplitude of pulsation of the superficial temporal artery, facial temperature, blood pressure, heart rate and respiration rate were monitored during mental arithmetic and reaction time tests in 30 young women subject to classical [MIGRAINE], common migraine or episodically-recurring tension headaches, and in 10 others who rarely or never had [HEADACHE]s.","0"
"1756","TWrex-symptom","[HEADACHE]","432","440","[MIGRAINE]","337","345","To see whether vascular reactivity differed among clinically-defined headache categories, amplitude of pulsation of the superficial temporal artery, facial temperature, blood pressure, heart rate and respiration rate were monitored during mental arithmetic and reaction time tests in 30 young women subject to classical migraine, common [MIGRAINE] or episodically-recurring tension headaches, and in 10 others who rarely or never had [HEADACHE]s.","0"
"1757","TWrex-symptom","[SCLEROTIC SKULL BASE]","231","251","[SYNDROME]","17","25","Schinzel-Giedion [SYNDROME] (SGS) is a rare disorder with a likely autosomal recessive pattern of inheritance which is characterized by several facial dysmorphisms, midface hypoplasia, multiple skeletal anomalies including short and [SCLEROTIC SKULL BASE], short neck, and post-axial polydactyly.","0"
"1758","TWrex-symptom","[TACHYCARDIA]","51","62","[INAPPROPRIATE SINUS TACHYCARDIA]","0","31","[INAPPROPRIATE SINUS TACHYCARDIA] is a nonparoxysmal [TACHYCARDIA] characterized by high resting heart rates and a disproportionate response to activity.","0"
"1761","TWrex-symptom","[HEADACHE]","143","151","[MIGRAINE]","84","92","Pattern reversal visual evoked potentials (PVEPs) were recorded in 20 patients with [MIGRAINE] with aura (MA), 19 patients with migraine without [HEADACHE] (migraine equivalent; ME) during interictal periods, and 34 normal subjects.","0"
"1762","TWrex-symptom","[HEADACHE]","143","151","[MIGRAINE]","126","134","Pattern reversal visual evoked potentials (PVEPs) were recorded in 20 patients with migraine with aura (MA), 19 patients with [MIGRAINE] without [HEADACHE] (migraine equivalent; ME) during interictal periods, and 34 normal subjects.","0"
"1764","TWrex-symptom","[HEMIPLEGIA]","197","207","[FHM]","154","157","They include attacks of migraine with typical aura when a unilateral weakness is part of the aura, severe hemiplegic attacks similar to those reported in [FHM] but sporadic, migrainous infarcts with [HEMIPLEGIA], and, for some authors, alternating hemiplegia of childhood.","0"
"1765","TWrex-symptom","[HEMIPLEGIA]","244","254","[FHM]","154","157","They include attacks of migraine with typical aura when a unilateral weakness is part of the aura, severe hemiplegic attacks similar to those reported in [FHM] but sporadic, migrainous infarcts with hemiplegia, and, for some authors, alternating [HEMIPLEGIA] of childhood.","0"
"1766","TWrex-symptom","[PATTERN]","128","135","[CARCINOMA]","102","111","The tumor was removed under lateral rhinotomy and histopathologic examination revealed adenoid cystic [CARCINOMA] with cribriform [PATTERN].","0"
"1768","TWrex-symptom","[CIRRHOSIS]","96","105","[SYNDROME]","40","48","The careful examination for Budd-Chiari [SYNDROME] should be done in cases with cryptogenic liver [CIRRHOSIS], particularly in countries where the prevalence of the syndrome is high.","0"
"1769","TWrex-symptom","[CIRRHOSIS]","96","105","[SYNDROME]","161","169","The careful examination for Budd-Chiari syndrome should be done in cases with cryptogenic liver [CIRRHOSIS], particularly in countries where the prevalence of the [SYNDROME] is high.","0"
"1770","TWrex-symptom","[DEPRESSION]","65","75","[MS]","143","145","Latent growth curve analysis was used to examine trajectories in [DEPRESSION] and the effects of covariates such as age, time since diagnosis of [MS], type of ms, and functional limitations on the extent to which depression changed in the study period.","0"
"1771","TWrex-symptom","[DEPRESSION]","65","75","[MS]","155","157","Latent growth curve analysis was used to examine trajectories in [DEPRESSION] and the effects of covariates such as age, time since diagnosis of ms, type of [MS], and functional limitations on the extent to which depression changed in the study period.","0"
"1772","TWrex-symptom","[DEPRESSION]","209","219","[MS]","143","145","Latent growth curve analysis was used to examine trajectories in depression and the effects of covariates such as age, time since diagnosis of [MS], type of ms, and functional limitations on the extent to which [DEPRESSION] changed in the study period.","0"
"1773","TWrex-symptom","[DEPRESSION]","209","219","[MS]","155","157","Latent growth curve analysis was used to examine trajectories in depression and the effects of covariates such as age, time since diagnosis of ms, type of [MS], and functional limitations on the extent to which [DEPRESSION] changed in the study period.","0"
"1774","TWrex-symptom","[MICROCALCIFICATION]","48","66","[DCIS]","75","79","Multivariate analysis found that the absence of [MICROCALCIFICATION]s within [DCIS] ducts, patient age, number of slides with DCIS or TDLUs with COL, and the number of DCIS ducts or TDLUs with COL within 0.42 cm of the final margin were related significantly to TR/MM recurrence.","0"
"1775","TWrex-symptom","[MICROCALCIFICATION]","48","66","[DCIS]","122","126","Multivariate analysis found that the absence of [MICROCALCIFICATION]s within DCIS ducts, patient age, number of slides with [DCIS] or TDLUs with COL, and the number of DCIS ducts or TDLUs with COL within 0.42 cm of the final margin were related significantly to TR/MM recurrence.","0"
"1776","TWrex-symptom","[MICROCALCIFICATION]","48","66","[DCIS]","164","168","Multivariate analysis found that the absence of [MICROCALCIFICATION]s within DCIS ducts, patient age, number of slides with DCIS or TDLUs with COL, and the number of [DCIS] ducts or TDLUs with COL within 0.42 cm of the final margin were related significantly to TR/MM recurrence.","0"
"1778","TWrex-symptom","[FRENULUM]","166","174","[SYNDROME]","2","10","G [SYNDROME] is a familial constellation of congenital anomalies that include a distinctive facies, ocular hypertelorism, prominent occiput and forehead, short lingual [FRENULUM], stridor, hoarse cry, and laryngotracheoesophageal (LTE) clefts, as well as hypospadias and cryptorchidism.","0"
"1779","TWrex-symptom","[NEUTROPENIA]","142","153","[GLYCOGEN STORAGE DISEASE TYPE IB]","35","67","We describe a 16-year old boy with [GLYCOGEN STORAGE DISEASE TYPE IB], homozygous for the common 1211-1212delCT mutation, who never experienced [NEUTROPENIA], and did not suffer from frequent infections or inflammatory bowel disease.","0"
"1781","TWrex-symptom","[DIABETES MELLITUS]","135","152","[WFS1]","180","184","Wolfram syndrome 1 (WFS1, OMIM 222300), a rare genetic disorder characterized by optic nerve atrophy, deafness, diabetes insipidus and [DIABETES MELLITUS], is caused by mutations of [WFS1], encoding WFS1/wolframin.","0"
"1782","TWrex-symptom","[DIABETES MELLITUS]","135","152","[WFS1]","195","199","Wolfram syndrome 1 (WFS1, OMIM 222300), a rare genetic disorder characterized by optic nerve atrophy, deafness, diabetes insipidus and [DIABETES MELLITUS], is caused by mutations of WFS1, encoding [WFS1]/wolframin.","0"
"1783","TWrex-symptom","[MICROCALCIFICATION]","129","147","[RADIAL SCAR]","75","86","From recent case material, the authors present four cases of biopsy-proved [RADIAL SCAR]s associated with mammographically visible [MICROCALCIFICATION]s.","0"
"1785","TWrex-symptom","[FAILURE]","134","141","[SYNDROME]","18","26","Smith-Lemli-Opitz [SYNDROME] (SLOS), an autosomal recessive condition comprising multiple malformations, mental retardation, and growth [FAILURE], results from reduced activity of the final enzyme in cholesterol biosynthesis, 7-dehydrocholesterol Delta(7)-reductase (DHCR7.","0"
"1787","TWrex-symptom","[SUN SENSITIVITY]","56","71","[CSA]","121","124","Cockayne syndrome (CS) is another genetic disorder with [SUN SENSITIVITY] and defective TC-NER, caused by mutations in the [CSA] or CSB genes.","0"
"1788","TWrex-symptom","[PHEOCHROMOCYTOMA]","143","159","[DISEASE]","69","76","A 43-year-old male patient who was diagnosed as von Recklinghausen's [DISEASE] developed abdominal masses at 5 years after the adrenalectomy for [PHEOCHROMOCYTOMA].","0"
"1791","TWrex-symptom","[NEUTROPENIA]","83","94","[AUTOIMMUNE NEUTROPENIA]","46","68","Granulocyte (neutrophil) antibodies can cause [AUTOIMMUNE NEUTROPENIA], drug-induced [NEUTROPENIA], immune neutropenia after bone marrow transplantation, neonatal immune neutropenia, refractoriness to granulocyte transfusions as well as febrile and pulmonary transfusion reactions.","0"
"1792","TWrex-symptom","[NEUTROPENIA]","103","114","[AUTOIMMUNE NEUTROPENIA]","46","68","Granulocyte (neutrophil) antibodies can cause [AUTOIMMUNE NEUTROPENIA], drug-induced neutropenia, immune [NEUTROPENIA] after bone marrow transplantation, neonatal immune neutropenia, refractoriness to granulocyte transfusions as well as febrile and pulmonary transfusion reactions.","0"
"1793","TWrex-symptom","[NEUTROPENIA]","166","177","[AUTOIMMUNE NEUTROPENIA]","46","68","Granulocyte (neutrophil) antibodies can cause [AUTOIMMUNE NEUTROPENIA], drug-induced neutropenia, immune neutropenia after bone marrow transplantation, neonatal immune [NEUTROPENIA], refractoriness to granulocyte transfusions as well as febrile and pulmonary transfusion reactions.","0"
"1794","TWrex-symptom","[FAILURE]","130","137","[DISEASE]","79","86","ABPM has been able to detect significant differences in blood pressure in many [DISEASE] states in children including chronic renal [FAILURE], polycystic kidney disease, solitary functioning kidney, and after renal transplantation.","0"
"1795","TWrex-symptom","[FAILURE]","130","137","[DISEASE]","157","164","ABPM has been able to detect significant differences in blood pressure in many disease states in children including chronic renal [FAILURE], polycystic kidney [DISEASE], solitary functioning kidney, and after renal transplantation.","0"
"1797","TWrex-symptom","[NEUROFIBROMA]","170","182","[NEUROFIBROMATOSIS]","0","17","[NEUROFIBROMATOSIS] type 1 (von Recklinghausen disease) affects the gastrointestinal tract in up to 25% of cases, and in such cases is characterized by multiple submucosal [NEUROFIBROMA]s.","0"
"1798","TWrex-symptom","[BODY]","200","204","[PSAMMOMA]","85","93","In this study we analyzed the morphologic and ultrastructural characteristics of the [PSAMMOMA] bodies in ten meningiomas of different histologic subtypes, characterizing the components of the psammoma [BODY] and the elements of the tumor, such as the capillaries and degenerative cells that have been classically considered as initiators of the formation of these calcareous is structures.","0"
"1799","TWrex-symptom","[BODY]","200","204","[PSAMMOMA]","191","199","In this study we analyzed the morphologic and ultrastructural characteristics of the psammoma bodies in ten meningiomas of different histologic subtypes, characterizing the components of the [PSAMMOMA] [BODY] and the elements of the tumor, such as the capillaries and degenerative cells that have been classically considered as initiators of the formation of these calcareous is structures.","0"
"1800","TWrex-symptom","[POSTNATAL MICROCEPHALY]","84","106","[ANGELMAN]","25","33","The clinical features of [ANGELMAN] syndrome (AS) comprise severe mental retardation, [POSTNATAL MICROCEPHALY], macrostomia and prognathia, absence of speech, ataxia, and a happy disposition.","0"
"1801","TWrex-symptom","[MASS]","66","70","[POLYP]","168","173","Ultrasonography and computed tomography showed a larger papillary [MASS] in the fundus of the gallbladder with a maximum diameter of about 30 mm, the largest gallbladder [POLYP] ever reported to our knowledge.","0"
"1802","TWrex-symptom","[MASS]","22","26","[TAG]","27","30","Addition of a neutral [MASS] [TAG] to one of the RNA targets shifts the detected peaks to a higher mass/charge ratio, where complexes with small molecules can be identified unambiguously.","0"
"1803","TWrex-symptom","[MASS]","95","99","[TAG]","27","30","Addition of a neutral mass [TAG] to one of the RNA targets shifts the detected peaks to a higher [MASS]/charge ratio, where complexes with small molecules can be identified unambiguously.","0"
"1804","TWrex-symptom","[THROMBOCYTOPENIA]","198","214","[SYNDROME]","80","88","A family of autosomal-dominant diseases including May-Hegglin anomaly, Fechtner [SYNDROME], Sebastian syndrome, Alport syndrome, and Epstein syndrome are commonly characterized by giant platelets and [THROMBOCYTOPENIA].","0"
"1805","TWrex-symptom","[THROMBOCYTOPENIA]","198","214","[SYNDROME]","100","108","A family of autosomal-dominant diseases including May-Hegglin anomaly, Fechtner syndrome, Sebastian [SYNDROME], Alport syndrome, and Epstein syndrome are commonly characterized by giant platelets and [THROMBOCYTOPENIA].","0"
"1806","TWrex-symptom","[THROMBOCYTOPENIA]","198","214","[SYNDROME]","117","125","A family of autosomal-dominant diseases including May-Hegglin anomaly, Fechtner syndrome, Sebastian syndrome, Alport [SYNDROME], and Epstein syndrome are commonly characterized by giant platelets and [THROMBOCYTOPENIA].","0"
"1807","TWrex-symptom","[THROMBOCYTOPENIA]","198","214","[SYNDROME]","139","147","A family of autosomal-dominant diseases including May-Hegglin anomaly, Fechtner syndrome, Sebastian syndrome, Alport syndrome, and Epstein [SYNDROME] are commonly characterized by giant platelets and [THROMBOCYTOPENIA].","0"
"1810","TWrex-symptom","[FALL]","78","82","[SYNDROME]","126","134","Subsequently she developed postural tremor, loss of upward gaze, and frequent [FALL]s suggestive of Steele-Richardson-Olszewski [SYNDROME] (SROS.","0"
"1811","TWrex-symptom","[SEIZURE]","29","36","[STATUS]","50","56","If not properly treated, the [SEIZURE]s may lead to [STATUS] epilepticus.","0"
"1812","TWrex-symptom","[PAIN]","106","110","[FAMILIAL MEDITERRANEAN FEVER]","18","46","Crohn disease and [FAMILIAL MEDITERRANEAN FEVER] (FMF) are inflammatory diseases characterized by abdominal [PAIN] and fever.","0"
"1813","TWrex-symptom","[THROMBOCYTOPENIA]","196","212","[ITP]","166","169","Histopathological examination of autopsy samples of skin lesions revealed angiosarcoma, suggesting that Kasabach-Merritt syndrome (KMS) complicated with DIC, but not [ITP], was the primary cause of [THROMBOCYTOPENIA].","0"
"1815","TWrex-symptom","[CARCINOMA]","56","65","[MEN2]","0","4","[MEN2] refers to the inherited forms of medullary thyroid [CARCINOMA].","0"
"1816","TWrex-symptom","[ACROMEGALY]","55","65","[MCCUNE ALBRIGHT SYNDROME]","25","49","We report a patient with [MCCUNE ALBRIGHT SYNDROME] with [ACROMEGALY] and features predictive of difficult airway except a class I upper lip bite (ULB) test.","0"
"1817","TWrex-symptom","[DIARRHEA]","78","86","[ACUTE DIARRHEA]","116","130","3 years of age between September/97 and August/98, assisted at the Outpatient [DIARRHEA] Unit, or hospitalized due to [ACUTE DIARRHEA] in our Hospital.","0"
"1818","TWrex-symptom","[BRONCHIAL ASTHMA]","0","16","[ATOPIC DERMATITIS]","21","38","[BRONCHIAL ASTHMA] and [ATOPIC DERMATITIS] were treated more effectively if maximal doses of vitamin B6 were used.","0"
"1822","TWrex-symptom","[THROMBOCYTOPENIA]","20","36","[PURPURA]","37","44","Although thrombotic [THROMBOCYTOPENIA] [PURPURA] is the most reported hematologic adverse effect of clopidogrel; neutropenia, acquired hemophilia, isolated thrombocytopenia or idiopathic immune thrombocytopenia, and thrombotic thrombocytopenia purpura with hemolytic uremic syndrome are other rare yet recognized hematologic adverse effects of clopidogrel.","0"
"1825","TWrex-symptom","[THROMBOCYTOPENIA]","152","168","[PURPURA]","240","247","Although thrombotic thrombocytopenia purpura is the most reported hematologic adverse effect of clopidogrel; neutropenia, acquired hemophilia, isolated [THROMBOCYTOPENIA] or idiopathic immune thrombocytopenia, and thrombotic thrombocytopenia [PURPURA] with hemolytic uremic syndrome are other rare yet recognized hematologic adverse effects of clopidogrel.","0"
"1827","TWrex-symptom","[THROMBOCYTOPENIA]","190","206","[PURPURA]","240","247","Although thrombotic thrombocytopenia purpura is the most reported hematologic adverse effect of clopidogrel; neutropenia, acquired hemophilia, isolated thrombocytopenia or idiopathic immune [THROMBOCYTOPENIA], and thrombotic thrombocytopenia [PURPURA] with hemolytic uremic syndrome are other rare yet recognized hematologic adverse effects of clopidogrel.","0"
"1829","TWrex-symptom","[THROMBOCYTOPENIA]","223","239","[PURPURA]","240","247","Although thrombotic thrombocytopenia purpura is the most reported hematologic adverse effect of clopidogrel; neutropenia, acquired hemophilia, isolated thrombocytopenia or idiopathic immune thrombocytopenia, and thrombotic [THROMBOCYTOPENIA] [PURPURA] with hemolytic uremic syndrome are other rare yet recognized hematologic adverse effects of clopidogrel.","0"
"1830","TWrex-symptom","[THROMBOCYTHAEMIA]","54","70","[POLYCYTHAEMIA VERA]","22","40","Sixteen patients with [POLYCYTHAEMIA VERA] or essential [THROMBOCYTHAEMIA] were treated with interferon-alpha in order to normalize elevated platelets.","0"
"1831","TWrex-symptom","[SEIZURE]","94","101","[IGE]","120","123","Latencies from start of VEM to the first appearance of GSWD and the first clinically manifest [SEIZURE] were analyzed for [IGE] subsyndrome.","0"
"1832","TWrex-symptom","[SEIZURE]","69","76","[EPILEPSY]","13","21","Persons with [EPILEPSY] experience déjà vu phenomena with or without [SEIZURE] recognition.","0"
"1833","TWrex-symptom","[ARTHRITIS]","129","138","[LUPUS]","149","154","Since 1996, over 100 procedures were performed in children with different severe autoimmune diseases such as juvenile idiopathic [ARTHRITIS], systemic [LUPUS] erythematosus, systemic sclerosis, immune cytopaenias and Crohn's disease.","0"
"1835","TWrex-symptom","[CARCINOMA]","95","104","[BASAL CELL NEVUS SYNDROME]","30","55","A 48 year-old white male with [BASAL CELL NEVUS SYNDROME] presented with a metastatic basal cell [CARCINOMA] with neuroendocrine features.","0"
"1836","TWrex-symptom","[MYOCLONUS]","154","163","[DRPLA]","67","72","The subjects comprised 14 cases of clinicopathologically confirmed [DRPLA], including 7 cases of juvenile and 2 cases of early adult types with progressive [MYOCLONUS] epilepsy (PME), 5 cases of late adult type without PME, and 10 age-matched controls.","0"
