"index","relation-type","term1","b1","e1","term2","b2","e2","sentence","job"
"2107","TWrex-treat","[HEMOPHILIA]","159","169","[FVIII]","235","240","Factor VIII coagulant antigen (fviii:Ag) and fviii coagulant activity (fviii:C) were measured in 102 healthy individuals, in 5 hemophilia A carriers and in 21 [HEMOPHILIA] A patients before and after infusion of heat-treated high-purity [FVIII] concentrates.","0"
"2108","TWrex-treat","[VOMITING]","143","151","[SCOPOLAMINE]","57","68","Compared with flights using placebo, flights with buccal [SCOPOLAMINE] resulted in significantly lower scores for nausea (31%-35% reduction) and [VOMITING] (50% reduction in number of parabolas with vomiting.","0"
"2109","TWrex-treat","[VOMITING]","195","203","[SCOPOLAMINE]","57","68","Compared with flights using placebo, flights with buccal [SCOPOLAMINE] resulted in significantly lower scores for nausea (31%-35% reduction) and vomiting (50% reduction in number of parabolas with [VOMITING].","0"
"2110","TWrex-treat","[VON WILLEBRAND]","31","45","[FACTOR VIII]","0","11","[FACTOR VIII] activity (VIII:C), [VON WILLEBRAND] factor antigen (vWF:Ag), tissue plasminogen activator antigen (tPA), plasminogen activator inhibitor activity (PAI-1), antithrombin III, protein C and protein S were assayed before and 1, 3, 6, 12, 18, and 24 months after BMT.","0"
"2111","TWrex-treat","[INFLAMMATION]","48","60","[DICLOFENAC]","174","184","Piroxicam exercised a significant action on the [INFLAMMATION]-specific parameters (reduction of BSR by 6.15 mm maximum and of the alpha 2-globulin fraction by 0.75%), whereas [DICLOFENAC] did not.","0"
"2114","TWrex-treat","[MELANOMA]","95","103","[INTERFERON]","64","74","These data indicate a pathogenetic significance of disorders in [INTERFERON] production in uveal [MELANOMA] and may be used for the disease prognosis.","0"
"2115","TWrex-treat","[SEPSIS]","98","104","[ALPHA]","12","17","Drotrecogin [ALPHA] (activated), when administered to adult patients with clinically defined severe [SEPSIS], demonstrated a 6.1% absolute reduction (p=0.005) in 28-day all-cause mortality in one published, randomized, double-blind study of 1,690 patients (PROWESS.","0"
"2120","TWrex-treat","[ANOREXIA]","112","120","[TETRAHYDROCANNABINOL]","68","88","Purpose: To evaluate the appetite-stimulating properties of delta-9-[TETRAHYDROCANNABINOL] (THC) in patients with [ANOREXIA] due to advanced cancer.","0"
"2121","TWrex-treat","[DYSRHYTHMIA]","215","226","[ANTIARRHYTHMIC AGENT]","139","159","Three patients are free of relapses without antiarrhythmic drugs (follow-up: 14 to 17 months); three others are also free of relapses, but [ANTIARRHYTHMIC AGENT]s were required for treatment of other supraventricular [DYSRHYTHMIA]s (follow-up: 3 to 17 months); atrial flutter recurred within several days and persisted in spite of two more procedures in two patients.","0"
"2123","TWrex-treat","[CLUSTER HEADACHE]","74","90","[SUMATRIPTAN]","35","46","Recent data have demonstrated that [SUMATRIPTAN] offers effective relief of [CLUSTER HEADACHE] attacks, a condition where suffers experience repeated severe headache attacks, of short duration, during a cluster period.","0"
"2124","TWrex-treat","[TETANUS]","105","112","[TETANUS TOXOID]","8","22","Because [TETANUS TOXOID] is relatively heat stable, the traditional birth attendants were able to keep the [TETANUS] toxoid-filled UniJect devices in their homes for up to one month without refrigeration.","0"
"2125","TWrex-treat","[HYPERCALCAEMIA]","12","26","[APD]","64","67","Symptoms of [HYPERCALCAEMIA] were greatly relieved, especially by [APD].","0"
"2126","TWrex-treat","[ITP]","56","59","[ANTIBODY]","115","123","The diagnosis of antiphospholipid syndrome, rather than [ITP], was made because of anticardiolipin-beta 2GPI complex [ANTIBODY] and cerebral infarction.","0"
"2127","TWrex-treat","[HYPOGLYCEMIA]","135","147","[GLUCOSE]","98","105","The study aim was to investigate the effect of the route of insulin treatment on the glucagon and [GLUCOSE] production (GP) responses to [HYPOGLYCEMIA] in the diabetic rat.","0"
"2128","TWrex-treat","[ULCERATIVE COLITIS]","73","91","[HYDROCORTISONE]","55","69","The effectiveness of intravenous corticotrophin versus [HYDROCORTISONE] in [ULCERATIVE COLITIS] has been determined including whether previous steroid therapy influenced the better response to one rather than the other, but no such studies have ever been done in Crohn's disease.","0"
"2129","TWrex-treat","[SHOCK]","86","91","[DEXTRAN]","44","51","Pathophysiologic mechanisms involved in the [DEXTRAN] effect on mortality in intestinal [SHOCK] in rats were studied, using a standardized model for intestinal vascular obstruction.","0"
"2132","TWrex-treat","[BLEEDING]","100","108","[CIMETIDINE]","180","190","In 97 consecutive patients undergoing renal transplantation the incidence of upper gastrointestinal [BLEEDING] was registered over 180 days after allocation to treatment with either [CIMETIDINE] or placebo.","0"
"2133","TWrex-treat","[CARDIAC ARRHYTHMIA]","7","25","[ANTIARRHYTHMIC DRUG]","238","257","In the [CARDIAC ARRHYTHMIA] Pilot Study (CAPS), patients early (6-60 days) after acute myocardial infarction (MI) with ventricular premature complexes (VPCs) of over 10 per hour were randomized to receive, unaware, therapy with one of four [ANTIARRHYTHMIC DRUG]s (n = 402) or placebo (n = 100.","0"
"2134","TWrex-treat","[INFARCTION]","146","156","[STREPTOKINASE]","100","113","Thrombolysis with recombinant tissue-type plasminogen activator (rt-PA) and anisoylated plasminogen [STREPTOKINASE] activator (APSAC) in myocardial [INFARCTION] has been proved to reduce mortality.","0"
"2136","TWrex-treat","[HEART FAILURE]","141","154","[ISOSORBIDE]","40","50","These data suggest that hydralazine and [ISOSORBIDE] dinitrate do not improve skeletal muscle oxygen delivery during exercise in patients with [HEART FAILURE].","0"
"2137","TWrex-treat","[SYSTEMIC LUPUS ERYTHEMATOSUS]","29","57","[HYDROXYCHLOROQUINE]","260","278","Demographic characteristics, [SYSTEMIC LUPUS ERYTHEMATOSUS] Disease Activity Index (SLEDAI) and Systemic Lupus International Collaborating Clinics/ACR Damage Index (SDI) were assessed as well as administration, maximum dose and cumulative dose of prednisone and [HYDROXYCHLOROQUINE] (HCQ.","0"
"2138","TWrex-treat","[ARRHYTHMIA]","40","50","[ANTIARRHYTHMIC DRUG]","67","86","Patients who have malignant ventricular [ARRHYTHMIA]s and respond to [ANTIARRHYTHMIC DRUG] treatment are proven to have a much lower mortality than those who do not.","0"
"2139","TWrex-treat","[LEUKEMIA]","103","111","[FLUDARABINE]","171","182","We explored the relationship between the cytogenetic/biologic characteristics of B-chronic lymphocytic [LEUKEMIA] (B-CLL) cells and their tendency to undergo spontaneous or [FLUDARABINE]-induced apoptosis in vitro.","0"
"2140","TWrex-treat","[DIABETES]","128","136","[INSULIN]","13","20","CONCLUSIONS: [INSULIN] glargine substantially improved glycemic control in children and adolescents with poorly controlled type 1 [DIABETES].","0"
"2141","TWrex-treat","[ATRIAL FIBRILLATION]","94","113","[WARFARIN]","68","76","Left atrium appendage (LAA) occlusion is a potential alternative to [WARFARIN] in patients with [ATRIAL FIBRILLATION] who have contraindications to anticoagulation.","0"
"2143","TWrex-treat","[PAIN]","9","13","[PARACETAMOL]","67","78","At a low [PAIN] level the initial treatment is acetylsalicylic acid, [PARACETAMOL] or other nonsteroidal antiinflammatory drugs.","0"
"2144","TWrex-treat","[CANCER]","41","47","[CISPLATIN]","83","92","Thirty-one patients with small-cell lung [CANCER] (SCLC) were treated with VP-16 and [CISPLATIN] as first-line therapy.","0"
"2145","TWrex-treat","[AUTOIMMUNE HAEMOLYTIC ANAEMIA]","4","33","[INTRAVENOUS IMMUNOGLOBULIN]","196","222","The [AUTOIMMUNE HAEMOLYTIC ANAEMIA] (AIHA) and immune thrombocytopenic purpura (ITP) were refractory to conventional immunosuppressive therapy which included steroids, azathioprine, vincristine and [INTRAVENOUS IMMUNOGLOBULIN].","0"
"2146","TWrex-treat","[STONE]","56","61","[ACID]","124","128","In a five year study, 55 patients with radiolucent gall [STONE]s were treated with the combination of 7.5 mg chenodeoxycholic [ACID] (CDCA) and 5.0 mg ursodeoxycholic acid (UDCA)/kg/day--that is, half the monotherapeutic doses.","0"
"2147","TWrex-treat","[STONE]","56","61","[ACID]","163","167","In a five year study, 55 patients with radiolucent gall [STONE]s were treated with the combination of 7.5 mg chenodeoxycholic acid (CDCA) and 5.0 mg ursodeoxycholic [ACID] (UDCA)/kg/day--that is, half the monotherapeutic doses.","0"
"2148","TWrex-treat","[ANGINA]","51","57","[ISDN]","38","42","These results suggest the efficacy of [ISDN] tape on [ANGINA] pectoris, especially in its durability of action which lasts over 24 h.","0"
"2149","TWrex-treat","[CA]","14","16","[EPINEPHRINE]","96","107","The increased [CA] levels were mainly due to a rise in NE in stable hypertension and to a rise in [EPINEPHRINE] (E) in labile hypertension.","0"
"2150","TWrex-treat","[NTD]","48","51","[FOLIC ACID]","88","98","Studies on women with previous pregnancies with [NTD] showed that supplementary intake of [FOLIC ACID], with or without other vitamins, preconceptual period throughout the first trimester has a preventive effect on its recurrence.","0"
"2151","TWrex-treat","[CHRONIC MYELOID LEUKEMIA]","44","68","[BU]","4","6","The [BU]-Cy regimen has shown an advantage in [CHRONIC MYELOID LEUKEMIA] and TBI-Cy remains the standard conditioning regimen in acute lymphoblastic leukemia, but results are more conflicting in acute myeloid leukemia (AML.","0"
"2152","TWrex-treat","[CHRONIC MYELOID LEUKEMIA]","44","68","[BU]","155","157","The Bu-Cy regimen has shown an advantage in [CHRONIC MYELOID LEUKEMIA] and TBI-Cy remains the standard conditioning regimen in acute lymphoblastic leukemia, [BU]t results are more conflicting in acute myeloid leukemia (AML.","0"
"2153","TWrex-treat","[NIDDM]","126","131","[INSULIN]","89","96","Gestational diabetes mellitus (GDM) constitutes a risk factor for the development of non [INSULIN]-dependent diabetes mellitus ([NIDDM].","0"
"2154","TWrex-treat","[AMENORRHOEA]","105","116","[LHRH]","25","29","To monitor the effect of [LHRH] treatment on hypothalamo-pituitary-gonadal function, women with functional [AMENORRHOEA] were investigated by standardized LHRH and repeated clomiphene tests before and after LHRH therapy.","0"
"2155","TWrex-treat","[AMENORRHOEA]","105","116","[LHRH]","151","155","To monitor the effect of LHRH treatment on hypothalamo-pituitary-gonadal function, women with functional [AMENORRHOEA] were investigated by standardized [LHRH] and repeated clomiphene tests before and after LHRH therapy.","0"
"2156","TWrex-treat","[AMENORRHOEA]","105","116","[LHRH]","203","207","To monitor the effect of LHRH treatment on hypothalamo-pituitary-gonadal function, women with functional [AMENORRHOEA] were investigated by standardized LHRH and repeated clomiphene tests before and after [LHRH] therapy.","0"
"2157","TWrex-treat","[HYPERGLYCEMIA]","5","18","[INSULIN]","36","43","When [HYPERGLYCEMIA] supervenes, both [INSULIN] secretion and insulin-mediated glucose utilization are further compromised, mediated in part by sustained hyperglycemia itself.","0"
"2158","TWrex-treat","[HYPERGLYCEMIA]","5","18","[INSULIN]","58","65","When [HYPERGLYCEMIA] supervenes, both insulin secretion and [INSULIN]-mediated glucose utilization are further compromised, mediated in part by sustained hyperglycemia itself.","0"
"2159","TWrex-treat","[HYPERGLYCEMIA]","150","163","[INSULIN]","36","43","When hyperglycemia supervenes, both [INSULIN] secretion and insulin-mediated glucose utilization are further compromised, mediated in part by sustained [HYPERGLYCEMIA] itself.","0"
"2160","TWrex-treat","[HYPERGLYCEMIA]","150","163","[INSULIN]","58","65","When hyperglycemia supervenes, both insulin secretion and [INSULIN]-mediated glucose utilization are further compromised, mediated in part by sustained [HYPERGLYCEMIA] itself.","0"
"2161","TWrex-treat","[INFECTION]","141","150","[CEFOXITIN]","91","100","A single 2 g preoperative dose of cefotetan was as safe and effective as multiple doses of [CEFOXITIN] in the reduction of postoperative wound [INFECTION]s after colorectal surgery.","0"
"2162","TWrex-treat","[DIABETES]","27","35","[INSULIN]","62","69","The pathogenesis of type 2 [DIABETES] involves abnormalities in [INSULIN] action, insulin secretion, and endogenous glucose output (EGO.","0"
"2163","TWrex-treat","[DIABETES]","27","35","[INSULIN]","78","85","The pathogenesis of type 2 [DIABETES] involves abnormalities in insulin action, [INSULIN] secretion, and endogenous glucose output (EGO.","0"
"2164","TWrex-treat","[LYMPHOMA]","118","126","[MITOZANTRONE]","77","89","This report compares a pilot study followed by a trial of the combination of [MITOZANTRONE] and ifosfamide for relapsed [LYMPHOMA].","0"
"2167","TWrex-treat","[TYPE 2 DIABETES]","80","95","[PIOGLITAZONE]","0","12","[PIOGLITAZONE] also had a beneficial effect on the abnormal lipid profile seen in [TYPE 2 DIABETES].","0"
"2168","TWrex-treat","[THROMBOEMBOLISM]","55","70","[HEPARIN]","128","135","We report here a case of recurrent venous and arterial [THROMBOEMBOLISM], Trousseau's syndrome, in a cancer patient who developed [HEPARIN]-induced thrombocytopenia.","0"
"2169","TWrex-treat","[HBV]","108","111","[HBSAG]","33","38","Since the infectivity of chronic [HBSAG] carriers is falling with time, the researchers submit that long-term [HBV] vaccination is reducing hbv transmission in Keneba and Manduar.","0"
"2170","TWrex-treat","[HBV]","136","139","[HBSAG]","33","38","Since the infectivity of chronic [HBSAG] carriers is falling with time, the researchers submit that long-term hbv vaccination is reducing [HBV] transmission in Keneba and Manduar.","0"
"2171","TWrex-treat","[PARKINSON'S DISEASE]","57","76","[L-DOPA]","37","43","Among the catechol drugs used in the [L-DOPA] treatment of [PARKINSON'S DISEASE], the COMT inhibitors entacapone and tolcapone were not methylated, whereas the DOPA decarboxylase inhibitor benserazide was 15 times more specific substrate than L-DOPA, the target of COMT inhibition.","0"
"2172","TWrex-treat","[PARKINSON'S DISEASE]","57","76","[L-DOPA]","239","245","Among the catechol drugs used in the L-DOPA treatment of [PARKINSON'S DISEASE], the COMT inhibitors entacapone and tolcapone were not methylated, whereas the DOPA decarboxylase inhibitor benserazide was 15 times more specific substrate than [L-DOPA], the target of COMT inhibition.","0"
"2173","TWrex-treat","[DUODENAL ULCER DISEASE]","233","255","[RANITIDINE]","152","162","The effect on intragastric pH of two different dose regimens of continuous intravenous infusion of omeprazole (4 or 8 mg/h after a bolus of 80 mg), and [RANITIDINE] (0.25 mg/kg/h after a bolus of 50 mg) was studied in 10 patients with [DUODENAL ULCER DISEASE] in symptomatic remission.","0"
"2176","TWrex-treat","[PAIN]","110","114","[ASPIRIN]","92","99","The procedure is illustrated using a meta-analysis of the effectiveness of single-dose oral [ASPIRIN] for acute [PAIN], and results are also obtained for five other meta-analyses.","0"
"2177","TWrex-treat","[OVERLOAD]","5","13","[DEFEROXAMINE]","165","177","Iron [OVERLOAD] was evaluated for 26 beta-thalassemia homozygous patients, and 14 of them were submitted to intensive chelation therapy with high doses of intravenous [DEFEROXAMINE] (DF.","0"
"2178","TWrex-treat","[HYPOGLYCEMIA]","138","150","[GLUCOSE]","95","102","Insulin glargine should be considered for patients who continue to have elevated morning blood [GLUCOSE] levels and problems with nocturnal [HYPOGLYCEMIA] despite receiving NPH insulin at bedtime.","0"
"2179","TWrex-treat","[NEURAL TUBE DEFECT]","237","255","[FOLIC ACID]","130","140","In a series of nonrandomized and randomized intervention trials and case-control and cohort studies, women using multivitamins or [FOLIC ACID] supplements during the first 6 weeks of pregnancy experienced a three- to fourfold reduction in [NEURAL TUBE DEFECT]s among their offspring.","0"
"2180","TWrex-treat","[HYPERTENSION]","246","258","[FUROSEMIDE]","47","57","These data show that an acute stimulation with [FUROSEMIDE] and ambulation affects mainly the active form of plasma renin, and that the effect of age on inactive plasma renin in normal subjects may be different from that in patients with essential [HYPERTENSION].","0"
"2181","TWrex-treat","[PARKINSON'S DISEASE]","180","199","[SELEGILINE]","11","21","Both Zydis [SELEGILINE] (1.25 mg and 10 mg) treatments were shown to be therapeutically equivalent to conventional selegiline tablets 10 mg based on comparison of mean total Unified [PARKINSON'S DISEASE] Rating Scale (UPDRS) scores.","0"
"2182","TWrex-treat","[PARKINSON'S DISEASE]","180","199","[SELEGILINE]","113","123","Both Zydis Selegiline (1.25 mg and 10 mg) treatments were shown to be therapeutically equivalent to conventional [SELEGILINE] tablets 10 mg based on comparison of mean total Unified [PARKINSON'S DISEASE] Rating Scale (UPDRS) scores.","0"
"2183","TWrex-treat","[HEPATITIS]","87","96","[ANTIGEN]","107","114","Representative samples of each species were tested by solid phase radioimmunoassay for [HEPATITIS] B surface [ANTIGEN] (HBSAg, Australia antigen.","0"
"2184","TWrex-treat","[HEPATITIS]","87","96","[ANTIGEN]","133","140","Representative samples of each species were tested by solid phase radioimmunoassay for [HEPATITIS] B surface antigen (HBSAg, Australia [ANTIGEN].","0"
"2185","TWrex-treat","[VAGINOSIS]","10","19","[METRONIDAZOLE]","121","134","Bacterial [VAGINOSIS] was eradicated in 93% of women using intravaginal clindamycin and in 87% of women using intravaginal [METRONIDAZOLE].","0"
"2189","TWrex-treat","[NSCLC]","161","166","[DOCETAXEL]","129","138","For example, the overall objective response rate of 9.5% with single agent sunitinib compares similarly to that of pemetrexed or [DOCETAXEL] in previously treated [NSCLC] patients, but toxicity, notably fatigue, lead to discontinuation in 38% of patients.","0"
"2190","TWrex-treat","[MYOCARDIAL INFARCTION]","220","241","[STREPTOKINASE]","150","163","The purpose of this study was to investigate whether, to what extent, and through which mechanisms intravenous heparin, administered before and after [STREPTOKINASE], affects the plasma levels of D-dimer and fibrinogen in [MYOCARDIAL INFARCTION].","0"
"2191","TWrex-treat","[ANEMIA]","46","52","[IRON]","30","34","A relatively low incidence of [IRON] deficiency [ANEMIA] and high incidence of exhausted iron reserves in the women living in the high mountains indicates the participation of the adaptive-compensatory mechanisms in the development of iron-deficiency.","0"
"2192","TWrex-treat","[ANEMIA]","46","52","[IRON]","85","89","A relatively low incidence of iron deficiency [ANEMIA] and high incidence of exhausted [IRON] reserves in the women living in the high mountains indicates the participation of the adaptive-compensatory mechanisms in the development of iron-deficiency.","0"
"2193","TWrex-treat","[ANEMIA]","46","52","[IRON]","231","235","A relatively low incidence of iron deficiency [ANEMIA] and high incidence of exhausted iron reserves in the women living in the high mountains indicates the participation of the adaptive-compensatory mechanisms in the development of [IRON]-deficiency.","0"
"2194","TWrex-treat","[ASTHMA]","135","141","[SODIUM]","76","82","In a double-blind, crossover study we investigated the effect of nedocromil [SODIUM] on NKA-induced bronchoconstriction in subjects with [ASTHMA].","0"
"2195","TWrex-treat","[T2D]","246","249","[INSULIN]","114","121","In conclusion, the discovery of calpain-10 by a genetic approach has identified it as a molecule of importance to [INSULIN] signaling and secretion that may have relevance to the future development of novel therapeutic targets for the treatment of [T2D].","0"
"2196","TWrex-treat","[SALMONELLA]","15","25","[NALIDIXIC ACID]","252","266","Ten strains of [SALMONELLA] weltevreden isolated from poultry sources were examined and found to contain plasmid DNA ranging in size from 1.8 to 68.5 MD. All isolates were susceptible to carbenicillin, cephalothin, ceftriazone, gentamicin, kanamycin and [NALIDIXIC ACID], but resistance to bacitracin (100%), penicillin G (100%), rifampicin (100%), sulphamethoxazole (100%), cefuroxime (80%) and tetracycline (60%) was recorded.","0"
"2199","TWrex-treat","[DRUG TOXICITY]","206","219","[CHARCOAL]","78","86","It is suggested that the optimal regimen for the use of repeat dose activated [CHARCOAL] in acute drug intoxications is an initial dose of 75-100 g, followed by 50 g every 4 hours until the risks of systemic [DRUG TOXICITY] are reduced to an acceptable level.","0"
"2200","TWrex-treat","[TETANUS]","78","85","[TETANUS TOXOID]","47","61","Three groups of horses were injected; one with [TETANUS TOXOID] alone, one with [TETANUS] antitoxin alone and one in which the tetanus toxoid and tetanus antitoxin were injected simultaneously.","0"
"2201","TWrex-treat","[TETANUS]","78","85","[TETANUS TOXOID]","123","137","Three groups of horses were injected; one with tetanus toxoid alone, one with [TETANUS] antitoxin alone and one in which the [TETANUS TOXOID] and tetanus antitoxin were injected simultaneously.","0"
"2202","TWrex-treat","[TETANUS]","123","130","[TETANUS TOXOID]","47","61","Three groups of horses were injected; one with [TETANUS TOXOID] alone, one with tetanus antitoxin alone and one in which the [TETANUS] toxoid and tetanus antitoxin were injected simultaneously.","0"
"2203","TWrex-treat","[TETANUS]","142","149","[TETANUS TOXOID]","47","61","Three groups of horses were injected; one with [TETANUS TOXOID] alone, one with tetanus antitoxin alone and one in which the tetanus toxoid and [TETANUS] antitoxin were injected simultaneously.","0"
"2204","TWrex-treat","[TETANUS]","142","149","[TETANUS TOXOID]","123","137","Three groups of horses were injected; one with tetanus toxoid alone, one with tetanus antitoxin alone and one in which the [TETANUS TOXOID] and [TETANUS] antitoxin were injected simultaneously.","0"
"2205","TWrex-treat","[TUBERCULOSIS]","74","86","[RIFAMPICIN]","25","35","A new method for testing [RIFAMPICIN] (RFP) susceptibility of Mycobacterium [TUBERCULOSIS] was developed.","0"
"2206","TWrex-treat","[MALIGNANT MELANOMA]","160","178","[IFN]","135","138","To our knowledge this is the first report that demonstrates histological abnormalities of the glomerulus associated with postoperative [IFN]-beta therapy for the [MALIGNANT MELANOMA].","0"
"2209","TWrex-treat","[DEPRESSION]","83","93","[KAVA]","98","102","Whereas St. John's wort extracts are prescribed for the treatment of mild forms of [DEPRESSION] and [KAVA]-kava for unspecified anxiety syndromes, hop, balm, lavender, passiflora and valerian are traditionally administered against nervousness and sleep disturbances.","0"
"2210","TWrex-treat","[DEPRESSION]","83","93","[KAVA]","103","107","Whereas St. John's wort extracts are prescribed for the treatment of mild forms of [DEPRESSION] and kava-[KAVA] for unspecified anxiety syndromes, hop, balm, lavender, passiflora and valerian are traditionally administered against nervousness and sleep disturbances.","0"
