"index","relation-type","term1","b1","e1","term2","b2","e2","sentence","job"
"1837","TWrex-symptom","[INCREASED BLOOD PRESSURE]","45","69","[HYPERTENSIVE CRISIS]","0","19","[HYPERTENSIVE CRISIS] is a rare condition with [INCREASED BLOOD PRESSURE] and evidence of new or progressive severe end-organ damage.","0"
"1838","TWrex-symptom","[SEIZURE]","124","131","[DYSEMBRYOPLASTIC NEUROEPITHELIAL TUMOR]","45","83","We report a case of a 14-year-old boy with a [DYSEMBRYOPLASTIC NEUROEPITHELIAL TUMOR] and mental retardation with intractable [SEIZURE]s, which were demonstrated to be predominantly tonic seizures by video-electroencephalography (EEG.","0"
"1839","TWrex-symptom","[SEIZURE]","184","191","[DYSEMBRYOPLASTIC NEUROEPITHELIAL TUMOR]","45","83","We report a case of a 14-year-old boy with a [DYSEMBRYOPLASTIC NEUROEPITHELIAL TUMOR] and mental retardation with intractable seizures, which were demonstrated to be predominantly tonic [SEIZURE]s by video-electroencephalography (EEG.","0"
"1840","TWrex-symptom","[HEADACHE]","52","60","[MIGRAINE]","20","28","e., the presence of [MIGRAINE] or severe non-migraine [HEADACHE] increases a patient's risk of developing depression or panic attack disorder, whereas the presence of depression or panic attack disorder is associated with a greater risk of developing migraine, but not severe non-migraine headache.","0"
"1841","TWrex-symptom","[HEADACHE]","52","60","[MIGRAINE]","43","51","e., the presence of migraine or severe non-[MIGRAINE] [HEADACHE] increases a patient's risk of developing depression or panic attack disorder, whereas the presence of depression or panic attack disorder is associated with a greater risk of developing migraine, but not severe non-migraine headache.","0"
"1842","TWrex-symptom","[HEADACHE]","52","60","[MIGRAINE]","247","255","e., the presence of migraine or severe non-migraine [HEADACHE] increases a patient's risk of developing depression or panic attack disorder, whereas the presence of depression or panic attack disorder is associated with a greater risk of developing [MIGRAINE], but not severe non-migraine headache.","0"
"1843","TWrex-symptom","[HEADACHE]","52","60","[MIGRAINE]","276","284","e., the presence of migraine or severe non-migraine [HEADACHE] increases a patient's risk of developing depression or panic attack disorder, whereas the presence of depression or panic attack disorder is associated with a greater risk of developing migraine, but not severe non-[MIGRAINE] headache.","0"
"1844","TWrex-symptom","[HEADACHE]","285","293","[MIGRAINE]","20","28","e., the presence of [MIGRAINE] or severe non-migraine headache increases a patient's risk of developing depression or panic attack disorder, whereas the presence of depression or panic attack disorder is associated with a greater risk of developing migraine, but not severe non-migraine [HEADACHE].","0"
"1845","TWrex-symptom","[HEADACHE]","285","293","[MIGRAINE]","43","51","e., the presence of migraine or severe non-[MIGRAINE] headache increases a patient's risk of developing depression or panic attack disorder, whereas the presence of depression or panic attack disorder is associated with a greater risk of developing migraine, but not severe non-migraine [HEADACHE].","0"
"1846","TWrex-symptom","[HEADACHE]","285","293","[MIGRAINE]","247","255","e., the presence of migraine or severe non-migraine headache increases a patient's risk of developing depression or panic attack disorder, whereas the presence of depression or panic attack disorder is associated with a greater risk of developing [MIGRAINE], but not severe non-migraine [HEADACHE].","0"
"1847","TWrex-symptom","[HEADACHE]","285","293","[MIGRAINE]","276","284","e., the presence of migraine or severe non-migraine headache increases a patient's risk of developing depression or panic attack disorder, whereas the presence of depression or panic attack disorder is associated with a greater risk of developing migraine, but not severe non-[MIGRAINE] [HEADACHE].","0"
"1848","TWrex-symptom","[CUTANEOUS INVOLVEMENT]","15","36","[RETICULOSIS]","126","137","The pattern of [CUTANEOUS INVOLVEMENT] and the presence of the large cells with convoluted nuclei is characteristic of pagetoid [RETICULOSIS].","0"
"1849","TWrex-symptom","[FIT]","84","87","[ATM]","191","194","The results indicated that the temperature dependence of K(H) for hydrogen peroxide [FIT]s to the Van't Hoff equation form, expressed as lnK(H) = a/T - b, and a = -deltaH/R, where K(H) is in M/[ATM] (M is mol/L), T is in degrees Kelvin, R is the ideal gas constant, and deltaH is the standard heat of solution.","0"
"1850","TWrex-symptom","[HEADACHE]","13","21","[STRESS HEADACHE]","163","178","Tension-type [HEADACHE] is now the term used to describe headaches that have previously been grouped under various ill-defined headings such as 'tension headache', '[STRESS HEADACHE]' and 'muscle contraction headache.","0"
"1851","TWrex-symptom","[HEADACHE]","55","63","[STRESS HEADACHE]","163","178","Tension-type headache is now the term used to describe [HEADACHE]s that have previously been grouped under various ill-defined headings such as 'tension headache', '[STRESS HEADACHE]' and 'muscle contraction headache.","0"
"1852","TWrex-symptom","[HEADACHE]","151","159","[STRESS HEADACHE]","163","178","Tension-type headache is now the term used to describe headaches that have previously been grouped under various ill-defined headings such as 'tension [HEADACHE]', '[STRESS HEADACHE]' and 'muscle contraction headache.","0"
"1853","TWrex-symptom","[HEADACHE]","204","212","[STRESS HEADACHE]","163","178","Tension-type headache is now the term used to describe headaches that have previously been grouped under various ill-defined headings such as 'tension headache', '[STRESS HEADACHE]' and 'muscle contraction [HEADACHE].","0"
"1854","TWrex-symptom","[COUGH]","181","186","[BORDETELLA PERTUSSIS]","64","84","We report on a previously healthy newborn suffering from severe [BORDETELLA PERTUSSIS] infection who developed hemolytic uremic syndrome (HUS) a few weeks after the onset of whooping [COUGH], with a fatal outcome.","0"
"1855","TWrex-symptom","[DYSPLASIA]","228","237","[GALLBLADDER ADENOMA]","192","211","The authors present two cases of anomalous pancreaticobiliary duct union that occurred in a mother and her daughter; the former was associated with gallbladder adenocarcinoma, and the latter, [GALLBLADDER ADENOMA] with high grade [DYSPLASIA].","0"
"1856","TWrex-symptom","[CARCINOMA]","19","28","[NBCCS]","297","302","Another basal cell [CARCINOMA] from this patient did not show the loss of the normal copy of PTCH, instead a missense mutation in a highly conserved residue was identified in the nondeleted allele, illustrating two different mechanisms of PTCH inactivation in different tumors derived from the same [NBCCS] patient.","0"
"1857","TWrex-symptom","[INFECTION]","81","90","[HIV]","77","80","This paper will present the current knowledge on auto-antibodies observed in [HIV] [INFECTION], their putative mechanisms of generation and their possible implications for immune therapy.","0"
"1858","TWrex-symptom","[DISORDER]","150","158","[IMMUNE THROMBOCYTOPENIC PURPURA]","193","224","It is now well known that many patients infected with HIV type-1 will develop thrombocytopenia, and that at least 10% will develop a thrombocytopenic [DISORDER] clinically indistinguishable from [IMMUNE THROMBOCYTOPENIC PURPURA].","0"
"1859","TWrex-symptom","[PROGRESSIVE MYOCLONUS EPILEPSY]","82","112","[DISEASE]","9","16","Lafora's [DISEASE] (LD) is a comparatively frequent and particularly severe type of [PROGRESSIVE MYOCLONUS EPILEPSY].","0"
"1861","TWrex-symptom","[XANTHOMA]","138","146","[XANTHOMATOSIS]","17","30","Cerebrotendinous [XANTHOMATOSIS] is a rare familial sterol storage disease with accumulation of cholestanol and cholesterol particularly in [XANTHOMA]s, bile and brain.","0"
"1862","TWrex-symptom","[ABDOMINAL PAIN]","105","119","[CROHN]","15","20","This pediatric [CROHN]'s disease activity index (PCDAI) included (a) subjective reporting of the degree of [ABDOMINAL PAIN], stool pattern, and general well-being; (b) presence of extraintestinal manifestations, such as fever, arthritis, rash, and uveitis; (c) physical examination findings; (d) weight and height; and (e) hematocrit, erythrocyte sedimentation rate, and serum albumin.","0"
"1863","TWrex-symptom","[INFARCTION]","29","39","[HOMOCYSTINURIA]","47","61","We report a case of cerebral [INFARCTION] due to [HOMOCYSTINURIA].","0"
"1864","TWrex-symptom","[PARKINSONIAN SYNDROME]","52","73","[PROGRESSIVE SUPRANUCLEAR PALSY]","0","30","[PROGRESSIVE SUPRANUCLEAR PALSY] (PSP) is an atypical [PARKINSONIAN SYNDROME] characterised by akinesis, rigidity, falls, supranuclear gaze palsy and cognitive, particularly executive, dysfunction.","0"
"1865","TWrex-symptom","[SEIZURE]","304","311","[EPILEPTIC SEIZURE]","110","127","Moreover, in an ambulatory setting, the postictal period and its related signs is usually the only part of an [EPILEPTIC SEIZURE] that is accessible to the physician's examination and might therefore add some information to the differential diagnosis of paroxysmal events, such as epileptic or psychogenic [SEIZURE]s published with videosequences.","0"
"1866","TWrex-symptom","[INFECTION]","149","158","[CMV]","145","148","Neonatal mortality and progression to early CLD should be considered in the list of possible neonatal sequelae resulting from recurrent maternal [CMV] [INFECTION].","0"
"1867","TWrex-symptom","[PAIN]","18","22","[PERIOD]","92","98","In all cases Noot [PAIN] had lasted 1 to 5 months, despite CT examination during this painful [PERIOD].","0"
"1868","TWrex-symptom","[PAIN]","84","88","[PERIOD]","92","98","In all cases Noot pain had lasted 1 to 5 months, despite CT examination during this [PAIN]ful [PERIOD].","0"
"1869","TWrex-symptom","[DIARRHEA]","86","94","[CROHN]","59","64","A patient with an ileocolectomy and proximal ileostomy for [CROHN]'s disease had severe [DIARRHEA] and steatorrhea.","0"
"1870","TWrex-symptom","[MYOCLONUS]","94","103","[LAFORA'S DISEASE]","0","16","[LAFORA'S DISEASE] (LD) is a comparatively frequent and particularly severe type of progressive [MYOCLONUS] epilepsy.","0"
"1871","TWrex-symptom","[OPTIC ATROPHY]","68","81","[LEIGH DISEASE]","25","38","In a 2-year-old boy with [LEIGH DISEASE], spasticity, dysarthria, and [OPTIC ATROPHY] gradually developed.","0"
"1872","TWrex-symptom","[METASTATIC LESION]","90","107","[METASTASIS]","61","71","The patient died 2 months later and the autopsy showed local [METASTASIS] only, without any [METASTATIC LESION] in the lungs or other organs.","0"
"1873","TWrex-symptom","[HEADACHE]","55","63","[DISORDER]","90","98","Migraine, tension-type, cluster, and analgesic-rebound [HEADACHE]s are all primary headache [DISORDER]s.","0"
"1874","TWrex-symptom","[HEADACHE]","81","89","[DISORDER]","90","98","Migraine, tension-type, cluster, and analgesic-rebound headaches are all primary [HEADACHE] [DISORDER]s.","0"
"1875","TWrex-symptom","[PAIN]","72","76","[ENDOMETRIOSIS]","89","102","Besides the problems of dysmenorrhea, dyspareunia and chronic abdominal [PAIN], women with [ENDOMETRIOSIS] are often infertile.","0"
"1876","TWrex-symptom","[HYPERSENSITIVITY]","110","126","[ATAXIA TELANGIECTASIA]","0","21","[ATAXIA TELANGIECTASIA] (A-T) is a human genetic disorder characterized by progressive cerebellar degeneration, [HYPERSENSITIVITY] to ionizing radiation (IR), immunodeficiency, and high cancer risk.","0"
"1877","TWrex-symptom","[HYPERURICEMIA]","148","161","[SYNDROME]","94","102","Inherited mutations in the human HPRT1 gene result in three different phenotypes: Lesch-Nyhan [SYNDROME] (LNS or LND), LND variants, and HPRT-related [HYPERURICEMIA] (HRH.","0"
"1879","TWrex-symptom","[FEVER]","120","125","[MONONUCLEOSIS]","101","114","A serious reaction with a 18% overall mortality, phenytoin hepatitis may closely resemble infectious [MONONUCLEOSIS] with [FEVER], pharyngitis, lymphadenopathy, and atypical lymphocytosis.","0"
"1883","TWrex-symptom","[MACROGLOSSIA]","103","115","[BECKWITH-WIEDEMANN]","19","37","An infant with the [BECKWITH-WIEDEMANN] syndrome is described, with emphasis placed on the occurrence of [MACROGLOSSIA] and possible maxillofacial deformities.","0"
"1885","TWrex-symptom","[THROMBOCYTOPENIA]","118","134","[GESTATIONAL THROMBOCYTOPENIA]","136","164","Foetal thrombocytopenia can be caused by maternal complications (immune thrombocytopenic purpura, neonatal alloimmune [THROMBOCYTOPENIA], [GESTATIONAL THROMBOCYTOPENIA], preeclampsia, alloimmune haemolytic disease) or infectious diseases (toxoplasmosis, cytomegalovirus, rubella) or be of true foetal origin (chromosomal abnormalities, malformations, congenital thrombocytopenia, intrauterine growth retardation.","0"
"1888","TWrex-symptom","[THROMBOCYTOPENIA]","7","23","[ITP]","170","173","Immune [THROMBOCYTOPENIA] (itp) is a bleeding disorder characterized by antibody-opsonized platelets being prematurely destroyed in the spleen, although some patients with [ITP] may have a cell-mediated form of thrombocytopenia.","0"
"1890","TWrex-symptom","[THROMBOCYTOPENIA]","207","223","[ITP]","170","173","Immune thrombocytopenia (itp) is a bleeding disorder characterized by antibody-opsonized platelets being prematurely destroyed in the spleen, although some patients with [ITP] may have a cell-mediated form of [THROMBOCYTOPENIA].","0"
"1892","TWrex-symptom","[DYSFUNCTION]","158","169","[MICROANGIOPATHIC HEMOLYTIC ANEMIA]","73","106","Thrombotic thrombocytopenic purpura (TTP) is a syndrome characterized by [MICROANGIOPATHIC HEMOLYTIC ANEMIA] and thrombocytopenia with varying degrees of renal [DYSFUNCTION], neurologic signs and symptoms, and fever.","0"
"1893","TWrex-symptom","[THROMBOCYTOPENIA]","31","47","[IDIOPATHIC THROMBOCYTOPENIC PURPURA]","76","111","A 42-yr-old man presented with [THROMBOCYTOPENIA] 25 yr after splenectomy for [IDIOPATHIC THROMBOCYTOPENIC PURPURA] (ITP.","0"
"1894","TWrex-symptom","[HEMATURIA]","129","138","[BENIGN HEMATURIA]","9","25","Familial [BENIGN HEMATURIA] (FBH) is a common autosomal dominant disorder characterized by the presence of persistent or recurrent [HEMATURIA].","0"
"1896","TWrex-symptom","[STRABISMUS]","99","109","[C SYNDROME]","401","411","We report on a patient with trigonocephaly, biparietal widening as a result of metopic synostosis, [STRABISMUS], upslanted palpebral fissures, apparently low-set ears with abnormal helices, deeply furrowed palate, postaxial polysyndactyly of the feet, ankle flexion deformities, cryptorchidism, loose skin, and severe mental retardation, findings compatible with a diagnosis of the Opitz trigonocephaly [C SYNDROME] (OTS.","0"
"1897","TWrex-symptom","[HEADACHE]","146","154","[MIGRAINE]","137","145","Severe peripheral vasoconstriction of the legs due to hypersensitivity to small doses of ergotamine tartrate developed in a patient with [MIGRAINE] [HEADACHE]s.","0"
"1899","TWrex-symptom","[PAIN]","24","28","[COMPLEX REGIONAL PAIN SYNDROME]","168","198","Causes of non-malignant [PAIN] that may represent an indication for intrathecal drug-delivery systems include: failed back syndrome, neuropathic pain, axial spinal pain, [COMPLEX REGIONAL PAIN SYNDROME], diffuse pain, brachial plexitis, central pain, failed spinal cord stimulation (SCS) therapy, arachnoiditis, poststroke pain, spinal cord injury pain and peripheral neuropathy.","0"
"1900","TWrex-symptom","[PAIN]","143","147","[COMPLEX REGIONAL PAIN SYNDROME]","168","198","Causes of non-malignant pain that may represent an indication for intrathecal drug-delivery systems include: failed back syndrome, neuropathic [PAIN], axial spinal pain, [COMPLEX REGIONAL PAIN SYNDROME], diffuse pain, brachial plexitis, central pain, failed spinal cord stimulation (SCS) therapy, arachnoiditis, poststroke pain, spinal cord injury pain and peripheral neuropathy.","0"
"1901","TWrex-symptom","[PAIN]","162","166","[COMPLEX REGIONAL PAIN SYNDROME]","168","198","Causes of non-malignant pain that may represent an indication for intrathecal drug-delivery systems include: failed back syndrome, neuropathic pain, axial spinal [PAIN], [COMPLEX REGIONAL PAIN SYNDROME], diffuse pain, brachial plexitis, central pain, failed spinal cord stimulation (SCS) therapy, arachnoiditis, poststroke pain, spinal cord injury pain and peripheral neuropathy.","0"
"1902","TWrex-symptom","[PAIN]","208","212","[COMPLEX REGIONAL PAIN SYNDROME]","168","198","Causes of non-malignant pain that may represent an indication for intrathecal drug-delivery systems include: failed back syndrome, neuropathic pain, axial spinal pain, [COMPLEX REGIONAL PAIN SYNDROME], diffuse [PAIN], brachial plexitis, central pain, failed spinal cord stimulation (SCS) therapy, arachnoiditis, poststroke pain, spinal cord injury pain and peripheral neuropathy.","0"
"1903","TWrex-symptom","[PAIN]","241","245","[COMPLEX REGIONAL PAIN SYNDROME]","168","198","Causes of non-malignant pain that may represent an indication for intrathecal drug-delivery systems include: failed back syndrome, neuropathic pain, axial spinal pain, [COMPLEX REGIONAL PAIN SYNDROME], diffuse pain, brachial plexitis, central [PAIN], failed spinal cord stimulation (SCS) therapy, arachnoiditis, poststroke pain, spinal cord injury pain and peripheral neuropathy.","0"
"1904","TWrex-symptom","[PAIN]","319","323","[COMPLEX REGIONAL PAIN SYNDROME]","168","198","Causes of non-malignant pain that may represent an indication for intrathecal drug-delivery systems include: failed back syndrome, neuropathic pain, axial spinal pain, [COMPLEX REGIONAL PAIN SYNDROME], diffuse pain, brachial plexitis, central pain, failed spinal cord stimulation (SCS) therapy, arachnoiditis, poststroke [PAIN], spinal cord injury pain and peripheral neuropathy.","0"
"1905","TWrex-symptom","[PAIN]","344","348","[COMPLEX REGIONAL PAIN SYNDROME]","168","198","Causes of non-malignant pain that may represent an indication for intrathecal drug-delivery systems include: failed back syndrome, neuropathic pain, axial spinal pain, [COMPLEX REGIONAL PAIN SYNDROME], diffuse pain, brachial plexitis, central pain, failed spinal cord stimulation (SCS) therapy, arachnoiditis, poststroke pain, spinal cord injury [PAIN] and peripheral neuropathy.","0"
"1906","TWrex-symptom","[SEIZURE]","99","106","[EPILEPSY]","137","145","Intermittent vagal stimulation has the potentiality of reducing the number and/or the intensity of [SEIZURE]s in patients with intractable [EPILEPSY].","0"
"1907","TWrex-symptom","[HEADACHE]","12","20","[HEADACHE SYNDROME]","75","92","Orthostatic [HEADACHE] is the prototypical manifestation of SIH, but various [HEADACHE SYNDROME]s have also been reported such as migraine-like headache, tension-type headache and non-specific headaches among the others.","0"
"1908","TWrex-symptom","[HEADACHE]","140","148","[HEADACHE SYNDROME]","75","92","Orthostatic headache is the prototypical manifestation of SIH, but various [HEADACHE SYNDROME]s have also been reported such as migraine-like [HEADACHE], tension-type headache and non-specific headaches among the others.","0"
"1909","TWrex-symptom","[HEADACHE]","163","171","[HEADACHE SYNDROME]","75","92","Orthostatic headache is the prototypical manifestation of SIH, but various [HEADACHE SYNDROME]s have also been reported such as migraine-like headache, tension-type [HEADACHE] and non-specific headaches among the others.","0"
"1910","TWrex-symptom","[HEADACHE]","189","197","[HEADACHE SYNDROME]","75","92","Orthostatic headache is the prototypical manifestation of SIH, but various [HEADACHE SYNDROME]s have also been reported such as migraine-like headache, tension-type headache and non-specific [HEADACHE]s among the others.","0"
"1912","TWrex-symptom","[NORMAL INTELLIGENCE]","30","49","[MPS VI]","9","15","Although [MPS VI] patients have [NORMAL INTELLIGENCE] and no neurologic abnormalities, the disease is clinically heterogeneous: severely affected individuals expire in childhood or early adolescence while those with the mild or intermediate phenotypes have a slower, milder disease course and a longer life span.","0"
"1913","TWrex-symptom","[PARKINSONIAN]","153","165","[MULTIPLE SYSTEM ATROPHY]","0","23","[MULTIPLE SYSTEM ATROPHY] (MSA) is a neurodegenerative disease of undetermined aetiology that occurs sporadically and manifests itself as a combination of [PARKINSONIAN], autonomic, cerebellar and pyramidal signs.","0"
"1915","TWrex-symptom","[MYOCLONUS]","47","56","[SYNDROME]","138","146","Most of the affected individuals had laryngeal [MYOCLONUS] and more severe dystonia of the legs than usually reported in myoclonus-dystonia [SYNDROME].","0"
"1916","TWrex-symptom","[MYOCLONUS]","119","128","[SYNDROME]","138","146","Most of the affected individuals had laryngeal myoclonus and more severe dystonia of the legs than usually reported in [MYOCLONUS]-dystonia [SYNDROME].","0"
"1917","TWrex-symptom","[EFFUSION]","206","214","[MESOTHELIOMA]","63","75","We described the case a patient complaint of malignant pleural [MESOTHELIOMA] with unusual radiology presentation with the result that unilateral calcified pleural plaques with pleural thickening and pleural [EFFUSION] absence.","0"
"1918","TWrex-symptom","[SEIZURE]","145","152","[EPILEPSY]","58","66","We used a systemic chemoconvulsant model of temporal lobe [EPILEPSY] and bromodeoxyuridine (BrdU) labeling to investigate the effects of prolonged [SEIZURE]s on dentate granule cell neurogenesis in adult rats, and to examine the contribution of newly differentiated dentate granule cells to the network changes seen in this model.","0"
